,Company Name,Comapany Website,Address,Contact,Phone No.
1260,KAJA FOOD,www.kaja-food.de,Moerser Str. 135 47803 Krefeld Germany,"Jarg Temme, GeschäftsführerGeschäftsführer",+49 2151 747 786 0
1261,KALINA LTD.,www.kalina-foods.com,"Industrial Area, Street Rodopi 2B 8800 Sliven Bulgaria","Atanas Mermekliev, Chief Executive OfficerChief Executive OfficerBlagovest Popov, Trade ManagerTrade Manager",+359 887 232333
1262,KALNAPILIO-TAURO GRUPE LLC,www.kalnapilis.lt,Taikos St. 1 35147 Panevezys Lithuania,"Viacheslav Ignatenko, Export ManagerExport ManagerJurgita Skupiene, Export SpecialistExport Specialist",+370 694 07264
1263,N.P.T. KAMILA SH.P.K.,www.kamilachocolate.com,Str. Malsija e re 20000 Prizren Kosovo,"Dren Dorambari, Export ManagerExport Manager",+383 44183711
1264,KANAAN D.O.O.,www.kanaan.hr,Industrijska zona Jaǌevci 4 31540 Doǌi Miholjac Croatia,"Mario Stanesic, Sales, Purchasing and Marketing DirectorSales, Purchasing and Marketing DirectorAna Popovic, Export ManagerExport Manager",+385 989 81 60 65
1265,KAPTEIN,www.kaptein.info,Het Gemaal 2 1851 LW Heiloo The Netherlands,"Caroline IJsselstijn, Sales ManagerSales ManagerKathelijne van Hattum, Marketing ManagerMarketing Manager",+31 251 664 800
1266,KARALOON GMBH,www.karaloon.de,Schlosserstraße 31 59399 Olfen Germany,"Steffanie Kozole, Sales ManagerSales ManagerJoshua Schubert, SalesSales",
1267,KARAM FOODS INDUSTRIES CO. L.L.C.,www.karamcoffee.ae,"Building 27, Street 4 Al Quoz 3 358 Dubai United Arab Emirates","Mughis Uddin Ahmed, Marketing ManagerMarketing ManagerKushal Kumar Balami, Plant ManagerPlant Manager",+971 509404501
1268,KARAVELA SIA,www.sorensen.lv,Atlantijas 15 1015 Riga Latvia,"Sanita Legajeva, Sales DirectorSales DirectorRolands Romanovskis, Marketing ManagerMarketing Manager",+371 6 7496 400
1269,DR. KLAUS KARG KG,www.dr-karg.de,Alte Rother Straße 10 91126 Schwabach Germany,"Joachim Decker, VertriebsleiterVertriebsleiterHeike Haubner, Export ManagerExport Manager",+49 9122 6311 0
1270,KARIWALA INDUSTRIES LIMITED,www.kariwala.com,"Kariwala Towers, J1-5 Block EP, Sector V, Salt Lake 700091 Calcutta India","Anand Sureka, General ManagerGeneral ManagerAnil Kariwala, ChairmanChairman",+91 90735 54444
1271,H. KARLSSONS CHARKUTERIFABRIK AB,www.peasofheaven.se,Industrivägen 4 43892 Härryda Sweden,"Henrik Werner, Head of International ExpansionHead of International ExpansionLucas Karlsson, MarketingMarketing",+30 131525
1272,KARWENDEL-WERKE GMBH & CO. KG,www.exquisa.de,Karwendel Str. 6-16 86807 Buchloe Germany,"Gerald Kröger, Director ExportDirector ExportClaus Ringenberger, Prokurist, Leiter Vertrieb HandelsmarkenProkurist, Leiter Vertrieb Handelsmarken",+49 8241 502 343
1273,DIE KÄSEMACHER GMBH,www.kaesemacher.com,Europastrasse 5 3902 Vitis Austria,"Olivia Schierhuber, SalesSalesDiana Steiner, SalesSales",+43 2841 80045 38
1274,KAS EXPORTERS & IMPORTERS,www.ravirice.com,"05 - Grain Market 56300 Okara, Punjab Pakistan","Khalil Ur Rehman, Managing PartnerManaging PartnerSaeed Ur Rehman, PartnerPartner",
1275,KATHRINE ANDERSEN CHOKOLADE APS,www.kathrineandersen.com,Rho 12 8382 Hinnerup Denmark,"Jakob Skovsgaard, OwnerOwnerSusanne Nielsen, Sales ManagerSales Manager",+45 27515861
1276,KATLA EHF,www.katla.is,Kletthals 3 110 Reykjavik Iceland,"Tryggvi Magnússon, DirectorDirector",+354 5674422
1277,KAUNO GRUDAI,www.kggroup.eu,H. and O. Minkovskiu str. 63 46550 Kaunas Lithuania,"Oksana Simoliunaite, Brand ManagerBrand ManagerRolandas Grigalius, Brand Manager (Pet Food)Brand Manager (Pet Food)",+370 3775 08 30
1278,KECSKEMÉTI KONZERV KFT.,www.kkkft.hu,Szolnoki út 35. 6000 Kecskemét Hungary,"Balázs Micsinay, Sales DirectorSales DirectorGabriella Pusztai, Sales ManagerSales Manager",+36 76 546 060
1279,"KEDAINIU KONSERVU FABRIKAS, JSC",www.kkf.lt,Kedainiu str. 50 Singaliai 58191 Kedainiu raj. Lithuania,"Vytenis Cimielius, Marketing ManagerMarketing Manager",+370 347 77282
1280,KEKBEL- MAX SP. Z O.O. SP. K.,www.kekbel.pl,Belecin 127 64-231 Belecin Poland,"Michal Pinkowski, Sales ManagerSales Manager",+48 695 229 953
1281,KELLYS BAKERY,www.kellysbakery.ie,Unit 4 Ardcavan Business Park Y35PP20 Wexford Ireland,"Conor Kelly, Business DevelopementBusiness Developement",+353 539122588
1282,KELSEN GROUP A/S,www.kelsen.com,Bredgade 27 8766 Nørre Snede Denmark,"Kim Iversen, Market DirectorMarket Director",
1283,KENTAUR AG,www.kentaur.ch,Gässli 6 3432 Lützelflüh Switzerland,"Manfred Blatter, Chief Executive OfficerChief Executive OfficerNicolas Hängärtner, Sales ManagerSales Manager",+41 344 606 111
1284,KERN TEC GMBH,www.kern-tec.com,Wielandsthal 16 3130 Herzogenburg Austria,"Luca Fichtinger, Chief Executive OfficerChief Executive Officer",+43 6603852904
1285,KERRY FOODS,www.kerrygroup.com,"Thorpe Lea Manor, Thorpe Lea Road TW20 8HY Egham, Surrey United Kingdom","Tim Lynch, Customer Marketing ManagerCustomer Marketing ManagerClaire Chauvet, Sales DirectorSales Director",+44 1784 430 777
1286,KETEN LTD,www.keten.bg,"39 Vladimir Vazov Blvd., Fl. 7 1000 Sofia Bulgaria","Petya Krastanova, Export ManagerExport Manager",+359 893443312
1287,KEVA FRAGRANCES,www.creative-flavours-fragrances.com,Stadhouderskade 14 B 1054 ES Amsterdam The Netherlands,"Paul Hodges, Sales ManagerSales ManagerJitesh Chandarana, European Account ManagerEuropean Account Manager",+31 654 303 730
1288,KGB - KINGREEN GENERAL BEVERAGES,www.eloadrink.com,20 Rue Jacques Prévert Beryl 2A 33700 Merignac France,"Johan Aulong, Marketing DirectorMarketing Director",
1289,KHALED DAOUD ALNATSHEH & PARTNERS CO.,www.aloqabnuts.com,"Almoqableen, Alqorontol Street 11591 Amman Jordan","Hussam Albashaish, Export ManagerExport Manager",+962 792971752
1290,KILARGO SP. Z O.O.,www.kilargo.pl,Piotrkowska 60 90-105 Lódz Poland,"Elzbieta Grzebska, Marketing ManagerMarketing ManagerPatrycja Tronina, Marketing SpecialistMarketing Specialist",+48 538 555 585
1291,KIM'S CHOCOLATES N.V,www.kimchoc.be,Grijpenlaan 11 3300 Tienen Belgium,"Marc Quirijnen, Chief Executive OfficerChief Executive OfficerPeter Bruynooghe, Commercial DirectorCommercial Director",+32 16 55 15 80
1292,KING FOOD APS,www.king-food.dk,Tonsbakken 3 2740 Skovlunde Denmark,"Mustafa Sahin, Sales DirectorSales Director",+45 21 900 103
1293,KIOENE SPA A SOCIO UNICO,www.kioene.it,Via Caltana 55 35010 Villanova di Camposampiero (PD) Italy,"Alberto Tonazzo, Sales ManagerSales ManagerIsabella Berto, Sales DepartmentSales Department",+39 049 9222311
1294,KIPCO-DAMACO N.V.,www.damaco-group.com,Dentergemstraat 164 8780 Oostrozebeke Belgium,"An-Marie Follens, Marketing ManagerMarketing ManagerOlivier Dhondt, Business DeveloperBusiness Developer",+32 56676211
1295,ZAGREBACKE PEKARNE KLARA D.D.,www.klara.hr,Utiǌska 48 10020 Zagreb Croatia,"Jadranka Oreškovic, Export Sales ManagerExport Sales ManagerPetar Thür, General ManagerGeneral Manager",+385 914 511 506
1296,KLEESCHULTE GMBH & CO. KG,www.kleeschulte.de,Bennenberg 6 33142 Büren Germany,"Bernd Kleeschulte, ManagerManager",+49 2951 600531
1297,KLEINEMAS FLEISCHWAREN GMBH & CO. KG,www.kleinemas.de,Industriestr. 35 33415 Verl Germany,"Andreas Rode, GeschäftsführerGeschäftsführer",+49 5246 9211 0
1298,KLETT SCHOKOLADE GMBH & CO. KG,www.klett-schoko.de,Reutlinger Str. 7 72147 Nehren Germany,"Ulf Baum, Chief Executive OfficerChief Executive OfficerChristopher Klett, Chief Executive OfficerChief Executive Officer",+49 7473 9541 0
1299,H. KLÜMPER GMBH & CO. KG,www.kluemper-schinken.de,Niedersachsenstr. 22 48465 Schüttorf Germany,"Eckhard Klümper, Managing PartnerManaging PartnerDennis Badberg, Sales DirectorSales Director",+49 5923 806 10
1300,HERBERT KLUTH (GMBH & CO. KG),www.kluth.com,Heidekoppel 31 24558 Henstedt-Ulzburg Germany,"Lennart Raeune, Leiter HandelsmarkenLeiter HandelsmarkenMicha Christian Kohn, Leiter MarkenvertriebLeiter Markenvertrieb",+49 4193 9662 0
1301,KM ZÜNDHOLZ INTERNATIONAL KARL MÜLLER GMBH,www.kmmatch.com,Bemannsbruch 16-18 74909 Meckesheim Germany,"Georg Müller, General ManagerGeneral ManagerJens Roth, Sales Product ManagerSales Product Manager",+49 6226 9202 0
1302,KOLIOS PITES S.A.,www.piteskolios.gr,3nd Km G. Gennimata Avenue 190 18 Magoula Greece,"Panagiotis Kolios, Co-OwnerCo-OwnerAndreas Kolios, Co-OwnerCo-Owner",+30 697 748 5937
1303,KOLYMPARI SA,www.kolympari-sa.gr,Rapaniana Kolympari 73006 Chania Crete Greece,"Nikolaos Michelakis, Chief Executive OfficerChief Executive OfficerNiki Makrynioti, Sales DepartmentSales Department",+30 2824022802
1304,KOMETA 99 LTD.,www.kometa.hu,Pécsi u. 67-69. 7400 Kaposvár Hungary,"Géza Zelenák, Export Key Account ManagerExport Key Account ManagerIvan Rédey, Marketing DirectorMarketing Director",+36 1 309 0151
1305,KONDITOREI HADERER GMBH,www.sweet.at,Marktplatz 14 4720 Neumarkt Austria,"Stefan Haderer, Chief Information OfficerChief Information OfficerSilvia Haderer, Chief Financial OfficerChief Financial Officer",+43 773350100
1306,KONEX-TIVA,www.konex-tiva.com,"9 Bulgaria Blvd., Bl. 3, Entr. 1, Suite 1 1408 Sofia Bulgaria","Konstantin Lambrev, General ManagerGeneral ManagerIliana Lambreva, Marketing ManagerMarketing Manager",+359 2 9581569
1307,KONLID D.O.O.,www.konlid.rs,Jovana Sterije Popovića 29 22330 Nova Pazova Serbia,"Vladan Kolarov, Sales ManagerSales ManagerMara Kolarov, Sales ManagerSales Manager",+381 62667488
1308,KONSTANTOPOULOS S.A. OLYMP,www.konstolymp.gr,3rd Km National Road Katerini - Larisa 60100 Katerini Greece,"Rodoula Anastasiadou, Sales ManagerSales ManagerAristotelis Kosmas, Sales ManagerSales Manager",+30 23510 47000
1309,KORNBUSCH & STARTING GMBH & CO. KG,www.kornbusch.com,Gelsenkirchenerstr. 11 46325 Borken Germany,"Klaus Falzer, Marketing ManagerMarketing Manager",+49 2861 948 02
1310,KORODUR INTERNATIONAL GMBH,www.korodur.de,Wernher-von Braun-Str. 4 92224 Amberg Germany,"Nikola Heckmann, Managing DirectorManaging DirectorHelmut Loreth, International Sales ManagerInternational Sales Manager",+49 9621 4759 0
1311,KÖRÖSTEJ LTD.,www.korostej.hu,Népfürdő U.22. B tower 9th floor 1138 Budapest Hungary,"Bela Nagy, Marketing and PR ManagerMarketing and PR Manager",+36 1 3493521
1312,KORUMA TEMIZLIK A.S.,www.korumatemizlik.com.tr,Deniz Mah. Petrol Ofisi Cad. No:43 Derince 41900 Kocaeli Turkey,"Halil Kozluca, Export SpecialistExport SpecialistSelma Gönül Murat, Export ManagerExport Manager",+90 262 2392270
1313,PCC CONSUMER PRODUCTS KOSMET SP. Z O.O.,www.kosmet.com.pl,Ul. Sienkiewicza 4 56-120 Brzeg Dolny Poland,"Bartosz Fabianowicz, Account ManagerAccount Manager",+48 667650968
1314,KOSOVA WINE SH.P.K.,www.kosovawine-ks.com,Str. Vellezerit Haradinaj nn 21010 Rahovec Kosovo,"Bejtullash Shehu, Export ManagerExport Manager",+383 49999901
1315,"KOSOVO INVESTMENT AND ENTERPRISE SUPPORT AGENCY (KIESA) / MINISTRY OF INDUSTRY, ENTREPRENEURSHIP AND TRADE",www.invest-ks.org,Str. Arbënor e Astrit Dehari no. 12 10000 Prishtina Kosovo,"Kreshnik Rugova, Senior Export Promotion OfficerSenior Export Promotion OfficerArber Muhaxheri, Director of the Private Sector Promotion DirectoryDirector of the Private Sector Promotion Directory",+381 38 200 36587
1316,KOSOVO MANUFACTURING CLUB (KMC),www.klubiprodhuesve.org,"Lorenc Antoni, No. 21 10000 Prishtina Kosovo","Astrit Panxha, Executive DirectorExecutive DirectorVllaznim Osmani, General SecretaryGeneral Secretary",+38 345666486
1317,KOURANTIDIS NIKOLAOS,www.regina-foods.gr,Block 39A-3rd Zone-Industrial Area of Sindos 57022 Thessaloniki Greece,"Nikolaos Kourantidis, OwnerOwnerElisabeth Theodoseli, Export ManagerExport Manager",+30 2310 706481
1318,KOUTSODIMOS WINERY,www.koutsodimos.com,2nd Klm. Nemea - Kiato 20500 Nemea Greece,"Maria Mitsikoudi, Export ManagerExport ManagerAchilleas Papadopoulos, Commercial DirectorCommercial Director",+30 698 083 8625
1319,KOYUNCU,www.koyuncusalt.com,Isci Blokları Mahallesi Mevlana Bulvarı Ege Plaza No:182/67 06530 Ankara Turkey,"Mert Kocan, Regional Sales ManagerRegional Sales Manager",+90 5074305732
1320,KOZMO CHEMICAL,www.kozmokimya.com,"Gokevler Mah. 2312. Sok. Ginza Corner Plaza No:16 D:31 34522 Esenyurt, Istanbul Turkey","Ozan Vural, Regional Export ManagerRegional Export ManagerAli Elci, Regional Export ManagerRegional Export Manager",+90 212 771 2211
1321,KOZMOPOLITAN GIDA SAN. VE TIC A.S.,www.cfgoil.com,"10007 Sok No 22 A Ulukent 35663 Menemen, Izmir Turkey","Okan Ozcelik, Export ManagerExport ManagerSinan Bozdag, General ManagerGeneral Manager",+90 232 833 4210
1322,M/S KPPL INDIA,www.kpplindia.com,"D-1601, 16th Floor, Lotus Corporate Park Western Express Highway, Goregaon (East) 400063 Mumbai India","Sharvari Mhatre, Sales CoordinatorSales CoordinatorKedar Khedekar, Senior Marketing ExecutiveSenior Marketing Executive",+91 7045496646
1323,KRAJOWA SPOLKA CUKROWA S.A.,www.polski-cukier.pl,Ul. Kraszewskiego 40 87-100 Toruń Poland,"Michał Grela, Lead AnalystLead Analyst",
1324,KRAMER GMBH SCHWARZWÄLDER WURSTSPEZIALITÄTEN,www.kramerswurst.de,Am Gansacker 28 79224 Umkirch Germany,"Barbara Kramer, GeschäftsführerinGeschäftsführerin",+49 7665 94520
1325,KRI - KRI SA,www.krikri.gr,3rd Km Serres-Drama 62100 Serres Greece,"Andreas Mylonas, Export DirectorExport DirectorKyriaki Savvidou, Exports Area Brand ManagerExports Area Brand Manager",+30 23210 68300
1326,KROMA NEDERLAND,www.kroma-nederland.nl,Schaepmanstraat 16 2672 AS Naaldwijk The Netherlands,"Wim Valstar, ManagerManager",+31 17 4643980
1327,KRONOS JSC,www.kronos.bg,Malashevska Street 8 1202 Sofia Bulgaria,"Nikolay Iliev, Sales ManagerSales Manager",+359 887656560
1328,KRONOS SA,www.kronos.com.gr,Mavrouvoni 58500 Skydra Greece,"Yiannis Tsitsis, Export DepartmentExport Department",+30 23810 89795
1329,KRÜGER GMBH & CO. KG,www.krueger-company.com,Senefelderstraße 44 51469 Bergisch Gladbach Germany,"Serge Ambrosini, Export Sales DirectorExport Sales Director",+49 2202 105 0
1330,KRYNICA VITAMIN SA,www.krynicavitamin.com,Ul. Matyldy 35 03-606 Warsaw Poland,"Katarzyna Sala-Kolodziej, Product Development ManagerProduct Development Manager",+48 22 743 83 90
1331,KTC EXPORT PVT.LTD.,www.ktcexport.com,4b Chetan Seth Street 2nd Floor 700007 Kolkata India,"Vivek Agarwal, DirectorDirector",+91 9903862178
1332,KTC KÖRNER TRADING CONSULTING GMBH,www.firstchoice.de,Hochstr. 60 45894 Gelsenkirchen Germany,"Michael Körner, GeschäftsführerGeschäftsführer",+49 209 3899167
1333,KUCHENMEISTER GMBH,www.kuchenmeister.de,Coesterweg 31 59494 Soest Germany,"Fred Schandel, Head of Export DepartmentHead of Export DepartmentFabian Meiberg, Head of Marketing and SalesHead of Marketing and Sales",+49 2921 7808 0
1334,KULODAY TECHNOPACK PVT. LTD.,www.kuloday.com,"25, Sona Udyog Industrial Estate Parsi Panchayat Road, Andheri East 400069 Mumbai India","Krishnakumar Prahladrai Chokhani, ChairmanChairmanAnuj Chokhani, Chief Executive OfficerChief Executive Officer",+91 22 4155 7799
1335,KUNAGONE S.A.,www.kunagone.eu,Pl. Kilinskiego 1 32-660 Chelmek Poland,"Artur Olejniczak, Chief Executive OfficerChief Executive Officer",+48 794575145
1336,KUPIEC LTD.,www.kupiec.pl,"Ul. Kupiecka 17 62-513 Krzymów, Paprotnia Poland","Joanna Darul-Parus, Export Marketing ManagerExport Marketing Manager",+48 63 241 3737
1337,INVESTMENT & DEVELOPMENT AGENCY OF LATVIA (LIAA),www.liaa.gov.lv,2 Perses Street 1442 Riga Latvia,"Dace Cima Steinberga, Project ManagerProject Manager",+371 670 39400
1338,LABAN FOODS BV,www.labanfoods.nl,Spaǌeweg 20 2411 PX Bodegraven The Netherlands,"Karel van Driel, Commercial ManagerCommercial ManagerChrista Laban, Sales DepartmentSales Department",+31 172 613 220
1339,LA BISCUITERIE DE LA CHAPELLE,www.maisondeflorentins.fr,58 Rue de Lorraine 44240 La Chapelle sur Erdre France,"Yann Ducarouge, General DirectorGeneral Director",+33 6 032 62 33 60
1340,LABORATOIRE NATUREL S.A.,www.labnaturel.com,Route Suisse 8A 1163 Etoy Switzerland,"Chantal van Ligten, International Sales ManagerInternational Sales ManagerElena Geerdink, Head of Sales EuropeHead of Sales Europe",+41 22 548 17 84
1341,LABORATOIRE ODOST,www.buccotherm.com,23 Rue Du Lac 32410 Castera-Verduzan France,"Sara Mayor, International Business DirectorInternational Business DirectorRoland Lascombes, Chief Executive OfficerChief Executive Officer",+33 562 478 920
1342,LABORATOIRE PIERRE CARON SAS,www.nutraskills.com,Parc Activites du Gros Chene 56460 Serent France,"Frédéric Herlin, PrésidentPrésident",+33 297 7376 76
1343,"LABORATORIOS MONTPLET, S.L.U.",www.montplet.es,Vía Trajana 53-55 08020 Barcelona Spain,"Vanessa Monfort, Chief Executive OfficerChief Executive OfficerPaola Tosini, Export ManagerExport Manager",+34 93 313 63 62
1344,LABORATORIOS NATUAROMATIC,www.laboratoriosnatuaromatic.com,"C/ Urano n5, Pol. Ind. Casa del Aire, Las Torres de Cotillas 30565 Murcia Spain","Maria Jose Gil Jara, CommunicationCommunication",+34 868 49 99 89
1345,LABORATORIOS YNSADIET S.A.,www.ynsadiet.com,"C/ Isaac Peral, 3 28914 Leganes Spain","Elena Requis Gonzalez, Export and Private Label DepartmentExport and Private Label DepartmentSonia Fernandez, Export and Private Label DepartmentExport and Private Label Department",+34 626 06 51 57
1346,LA BOULANGÈRE & CO,www.laboulangere.com,"Zi La Mongie 1, Rue Du Petit Bocage 85140 Essarts En Bocage France","Manuella Roy, Marketing ManagerMarketing Manager",+33 2 51 31 05 25
1347,LA CLAUDIA ITALIA SL,www.krdrinks.com,Nicolas Copernic 10 Pol Industrial El Brosquil 46780 Oliva Spain,"Alvaro Alcazar, Export ManagerExport ManagerFrancisco Malonda, General ManagerGeneral Manager",
1348,LACO SAS,www.lacoshop.com,"3, Avenue de l'Europe 67720 Hoerdt France","Anastasiia Blakytna, Business Development ManagerBusiness Development ManagerDyna Peter-Ott, Chief Executive OfficerChief Executive Officer",+33 770 08 80 35
1349,LA DISPENSA DI CAMPAGNA SRL,www.ladispensadicampagna.com,"Località Badia, 252/A 57022 Donoratico (LI) Italy","Sophia Jane Joly, Export ManagerExport Manager",+39 0565 774105
1350,LA DORIA S.P.A.,www.gruppoladoria.it,Via Nazionale 320 84012 Angri (SA) Italy,"Diodato Ferraioli, Head of Export SalesHead of Export SalesGiuseppe Tammaro, Italian Sales DirectorItalian Sales Director",+39 081 5166111
1351,LAEM GROUP D.O.O.,www.laemgroup.com,Miren 137 5291 Miren Slovenia,"Luka Klancic, ManagerManager",+386 40166002
1352,LA FARM S.A,www.lafarm.gr,6 klm Trikalon - Pilis 42100 Trikala Greece,"Louis Weber, Commercial DirectorCommercial DirectorElena Plexida, Financial ControllerFinancial Controller",+30 2431084480
1353,LA FOURNÉE DORÉE,www.lafourneedoree.fr,"6 Rue de l'Océan, CS 60014 85150 Les Achards France","Alexandre Remuzon, Export ManagerExport ManagerClémence Peau Hosokawa, Key Account ManagerKey Account Manager",+33 251 05 99 99
1354,LAGEEN TUBOPLAST,www.lageentubes.com,Kibbutz Yagur 3006500 Kibbutz Yagur Israel,"Karin Borenstein, Marcom ManagerMarcom ManagerYoav Grinberg, Chief Executive OfficerChief Executive Officer",+972 538 254 313
1355,LAGUELLE SAS,www.laguelle.com,"BP 4, 27 Route de Hérisson 03430 Cosne d'Allier France","Anaïs Bony, Assistance Commerciale ExportAssistance Commerciale ExportBernard Poirson, Direction CommercialeDirection Commerciale",+33 4 70 07 09 03
1356,LAÏTA,www.laita.com,"4 Rue Henri Becquerel, ZI de Kergaradec 29806 Brest Cedex 9 France","Joseph Tranvoiz, Private Label Sales Director FrancePrivate Label Sales Director FranceYvan Borgne, Export ManagerExport Manager",+33 298 425425
1357,LAITERIES H. TRIBALLAT,www.rians.com,650 Route des Malvettes 18220 Rians France,"Nicolas Delpon, International Sales DirectorInternational Sales DirectorOlivier Bouchet, Benelux Sales ManagerBenelux Sales Manager",+33 2 48 66 24 10
1358,LAJTHIZA INVEST SHA,www.lajthiza.al,"Rruga Locka, Kashar 1000 Tirane Albania","Dorjan Dogjani, General DirectorGeneral DirectorValbona Alushi, Head of FinanceHead of Finance",+355 676032013
1359,LAKI DOO,www.laki.rs,Stupcevici bb 31230 Arilje Serbia,"Boris Obradovic, Managing DirectorManaging DirectorMilos Jeremic, Commercial ManagerCommercial Manager",+38 131 896 595
1360,LAKMA STREFA SP. Z O.O.,www.lakma.com,Gajowa Str. 7 43-254 Warszowice Poland,"Maciej Paluch, Chief Executive OfficerChief Executive Officer",+48 32 435 3188
1361,LA MEDITERRANEA S.R.L.,www.lamediterraneasrl.it,Via Viazza Sinistra 2 40054 Mezzolara di Budrio (BO) Italy,"Samantha Miglianti, Administration DepartmentAdministration DepartmentMarco Meloro, Export and Import ManagerExport and Import Manager",+39 051 805839
1362,LAMERI SPA,www.lameri.it,Via D.F. Cattaneo n. 28/30 26020 San Bassano (CR) Italy,"Lia Diaz, Export Sales DepartmentExport Sales DepartmentChristophe Laurent, Export ManagerExport Manager",+39 0374 3821
1363,LANDENA KG,www.landena.at,Erzherzog-Johann Strasse 303 8950 Stainach-Prügg Austria,"Christoph Aigner, Marketing and Sales ManagerMarketing and Sales ManagerChristian Ruhdorfer, Sales and MarketingSales and Marketing",+43 3682 285 12
1364,LANDGARTEN GMBH & CO. KG,www.landgarten.at,Alte Wiener Str. 25 2460 Bruck/Leitha Austria,"Clemens Trimmel, International Sales ManagerInternational Sales Manager",+43 2162 64504
1365,LAND-LEBEN NAHRUNGSMITTEL GMBH,www.land-leben.com,Gewerbepark 1 5102 Anthering Austria,"Martin Ölz, GeschäftsführerGeschäftsführer",+43 662 451 285
1366,LANTMANNEN CEREALIA AB,www.lantmannencerealia.se,Sankt Goransgatan 160 112 17 Stockholm Sweden,"Karina Bessarabova, International Business Development CoordinatorInternational Business Development CoordinatorMarcus Burmester, International Business Development ManagerInternational Business Development Manager",+46 105562200
1367,LANTMANNEN UNIBAKE HOLDING A/S,www.lantmannen-unibake.com,"Oensvej 28, Hatting 8700 Horsens Denmark","Chris Houston, Group Market Intelligence ManagerGroup Market Intelligence Manager",+45 7628 5000
1368,LA PIZZA+1 SPA,www.lapizzapiuuno.it,Via G. Galilei 11/13 29027 Gariga di Podenzano (PC) Italy,"Elena Dzyuba, Marketing ManagerMarketing Manager",+39 0523042411
1369,LARCO FOODS B.V.,www.larcofoods.com,Industrielaan 10 5711 CX Someren The Netherlands,"Ruud Zoon, Account ManagerAccount ManagerLennert Goossens, Account ManagerAccount Manager",+31 493 4935 35
1370,LÄSSIG GMBH,www.laessig-fashion.de,Im Riemen 32 64832 Babenhausen Germany,"Janet Schwarz, Key Account ManagerKey Account ManagerMargarita Kühn, Key Account ManagerKey Account Manager",+49 6073 74489 0
1371,LAT EKO FOOD LTD.,www.latekofood.lv,Muizas Street 18a 2164 Adazi Latvia,"Iveta Freiberga, Business Development and SalesBusiness Development and SalesDiana Gaile, Export Sales ManagerExport Sales Manager",+371 20221169
1372,LATROVALIS & CO,www.latrovalis.eu,3rd km Serres - Nigrita 62125 Serres Greece,"Theodora Latrovalis, Sales ManagerSales ManagerEvi Latrovalis, Operations ManagerOperations Manager",+30 23210 46761
1373,LATVIJAS BALZAMS AS,www.lb.lv,A. Caka Street 160 1012 Riga Latvia,"Justs Dzedons, Private Label ManagerPrivate Label ManagerIntars Geidans, Chief Executive OfficerChief Executive Officer",+371 670 81213
1374,LATZIMAS S.A.,www.latzimasoil.gr,Panormo 74057 Rethymno Greece,"Nikolaos Douvros, Sales and ExportsSales and Exports",+30 6972 099 850
1375,LAURIERI SRL,www.laurieri.com,"Via G. Agnelli SNC, Z.I. La Martella 75100 Matera Italy","Adriano Buono, Sales ManagerSales ManagerGianni Laurieri, Sales ManagerSales Manager",+39 0835 302809
1376,LAUSITZER FRÜCHTEVERARBEITUNG GMBH,www.lausitzer-fruechte.de,Hauptstraße 79 02689 Sohland A.d. Spree Germany,"Maximilian Deharde, Mitglied der GeschäftsführungMitglied der GeschäftsführungAndreas Hentsch, Vertrieb, Export, Co-PackingVertrieb, Export, Co-Packing",+49 359 363 9511
1377,LAUX GMBH,www.laux-feinkost.de,Europa-Allee 29 54343 Föhren Germany,"Nicolai Schenk, Chief Executive OfficerChief Executive Officer",+49 65 02 930 93 42
1378,LAVINO KAPUR COTTONS PVT. LTD.,www.lavinokapur.com,"121/122 Mittal Chambers, Nariman Point 400021 Mumbai India","Pankaj Gangakhedkar, General Manager Sales and MarketingGeneral Manager Sales and MarketingChetan Kapur, ExecutiveExecutive",+91 22 6632 5141
1379,LB DISTRIBUTION SAS,www.laboratoirebiopharme.com,158 A Chemin des Guillaumets 84660 Maubec France,"Christèle Vian, Chief Executive OfficerChief Executive OfficerHakim Nacer, Chief Executive OfficerChief Executive Officer",+33 612707744
1380,LE BONTÀ SRL,www.lebonta.it,Via Maestri del Lavoro 7 50013 Campi Bisenzio Italy,"Giacinto Carapelli, Export DirectorExport DirectorElena Risaliti, Employee Export DepartmentEmployee Export Department",+39 055 7760150
1381,FROMAGERIE LE CENTURION SAS,www.le-centurion.com,ZA Les Portes du Nord 62820 Libercourt France,"Antoine Belperron, Export DirectorExport DirectorRomain Courret, Commercial DirectorCommercial Director",+33 321 79 33 79
1382,LECLERC FOODS,www.leclercfoods.com,"44 Park Drive 17752 Montgomery, PA U.S.A.","Frédéric Langlois, Senior VP Private Label Sales, Innovation, R&DSenior VP Private Label Sales, Innovation, R&DJean-Sebastien Leclerc, Vice PresidentVice President",+1 418 878 2601
1383,L'ECOPAIN D'IGNACE,www.lecopaindignace.be,Rue Ilya Prigogine 3 7850 Enghien Belgium,"Stephanie Vandekerkhove, Commercial ManagerCommercial ManagerIgnace Vandekerkhove, Chief Executive OfficerChief Executive Officer",+32 2 397 04 30
1384,LE DUC FINE FOOD B.V.,www.leduc-food.nl,Meester Snijderweg 18 3251 Ǉ Stellendam The Netherlands,"Dick den Hertog, DirectorDirectorDirk van Muylwijk, Commercial ManagerCommercial Manager",+31 187 60 50 17
1385,LEEV.NU B.V.,www.leev.nu,Van der Kunstraat 12 4251 LN Werkendam The Netherlands,"Eveline Rossou, MarketingMarketingAart-Jan Knauff, Managing DirectorManaging Director",+31 183679922
1386,LEIGHTON FOODS A/S,www.leightonfoods.com,Blomstervej 16 8381 Tilst Denmark,"Harald Keul, Chief Executive OfficerChief Executive OfficerMarco Geue, Director Sales and MarketingDirector Sales and Marketing",+45 87 45 18 70
1387,LEIMER KG,www.leimer.de,Kotzinger Straße 16 83278 Traunstein Germany,"Norbert Neumüller, Sales Manager InternationalSales Manager InternationalDaniel Stich, Key Account ManagerKey Account Manager",+49 861 7091 0
