,Company Name,Comapany Website,Address,Contact,Phone No.
629,DINA FOODS LIMITED,www.dinafoods.com,"24-26 Gorst Road, Park Royal NW10 6LE London United Kingdom","Warren Liffmann, National Account ManagerNational Account Manager",+44 208 621 5511
630,DINO CORSINI S.R.L.,www.dinocorsini.it,Via G. Brodolini nr. 4 40056 Valsamoggia Loc. Crespellano (Bologna) Italy,"Marco Zoldan, Sales DirectorSales DirectorElena Scaglioni, Sales DepartmentSales Department",+39 051 969072
631,DISARP SA,www.disarp.com,"Nuevo Acceso Playa, 22 46710 Daimús Spain","Carlos Ortega, Export ManagerExport ManagerJosé Tortosa, Commercial ManagerCommercial Manager",+34 695663047
632,DISEÑOS Y APLICACIONES DEL NO TEJIDO S.L,www.notejido.com,"Pl. Chaparral, Sn Santa Ana 23692 Alcala La Real Spain","Jaime López Arroyo, Sales DirectorSales DirectorJorge Montañez Gutierrez, Chief Executive OfficerChief Executive Officer",+34 953581683
633,DISPAR,www.dis-par.fr,218 chemin de la Jardinière ZI du Coudoulet 84100 Orange France,"Hester Damen, Sales ManagerSales ManagerAngèle Nicolas, Attachée de Direction GénéraleAttachée de Direction Générale",+33 4 90 11 17 40
634,BREZELBÄCKEREI DITSCH GMBH,www.ditsch.de,Robert-Bosch-Straße 44 55129 Mainz-Hechtsheim Germany,"Kai Rohde, Senior Vice President International SalesSenior Vice President International SalesMarcus Tiefenbacher, International Key Account ManagerInternational Key Account Manager",+49 6131 55 97 0
635,DIVERSPACK B.V.,www.diverspack.nl,Glazenmakersweg 8-10 3449 JK Woerden The Netherlands,"Dick Verburg, Managing DirectorManaging DirectorSander de Bruijne, SalesSales",+31 348 433 118
636,DIVIANDE B.V.,www.diviande.nl,Antennestraat 3 3903 LZ Veenendaal The Netherlands,"Marion Huisman, DirectorDirector",+31 318 799 500
637,DI VITA SPA,www.divita.it,Via Poirino 13 10022 Carmagnola (TO) Italy,"Alberto Pochettino, Chief Executive OfficerChief Executive Officer",+39 011 9716511
638,DK PACK AMBALAJ PAZ. SAN. TIC. LTD. STI.,www.unifim.com,Ortamahalle Mah/Semt Numunebagi Cad. No: 18 Ic Kapi No: 4 Bayrampasa 34030 Istanbul Turkey,"Muammer Durgut, Marketing ManagerMarketing ManagerAhmet Cemal Cihanbeyoglu, Export ManagerExport Manager",+90 533 424 1369
639,DLM SP. Z O.O.,www.dlm.net.pl,Wroclawska 1a 52-200 Suchy Dwor Poland,"Kate Wolski, Export ManagerExport ManagerMagdalena Kowalska, Vice PresidentVice President",+48 509127460
640,DMHERMES TRADE S.R.O.,www.bombusenergy.com,Jungmannova 299/2 79401 Krnov Czech Republic,"Marek Makovy, Export ManagerExport ManagerJiri Pavlacky, Export ManagerExport Manager",+420 554 611 717
641,DMK DEUTSCHES MILCHKONTOR GMBH,www.dmk.de,Industriestraße 27 27404 Zeven Germany,"Sascha Bischoff, Senior Manager Fairs and Event ManagerSenior Manager Fairs and Event Manager",+49 4281 72 0
642,DMK EIS GMBH,www.dmk-eis.de,Münsterstr. 31 48351 Everswinkel Germany,"Maximilian Curth, Marketing ManagerMarketing Manager",+49 2582 77 0
643,DNZ-DENIZ DIS TIC. SAN. VE PAZ. LTD. STI.,www.dnzfoods.com,Salihli OSB 304 Cad No 17 27700 Salihli Turkey,"Ibrahim Deniz, Operation ManagerOperation ManagerNecdet Ceyhun Deniz, Company OwnerCompany Owner",+90 507 630 2700
644,DO-IT B.V.,www.organic.nl,Hermesweg 7 3771 ND Barneveld The Netherlands,"Maaike Roelofse, CommunicationCommunication",+31 85 487 0487
645,DOBELES DZIRNAVNIEKS AS,www.dobelemill.eu,Spodribas iela 4 3701 Dobele Latvia,"Andris Abele, Export ManagerExport ManagerAndris Limanans, Export ManagerExport Manager",+371 251 582 40
646,DOCCAS FOOD S. LU,www.doccasfood.com,"P.I. Picassent, C/6, Nº33 33 46220 Picassent Spain","Marta Monterde, DirectorDirectorJavier Cases, Chief Executive OfficerChief Executive Officer",+34 647860510
647,DOLCERIA ALBA S.P.A.,www.dolceriaalba.it,Strada Vicinale delle Cappellette 8 10026 Santena (TO) Italy,"Carlo Rolle, Commercial DirectorCommercial Director",+39 011 0625611
648,DOLCIARIA GADESCHI S.P.A.,www.gadeschi.it,"Strada Provinciale 26, Km.5 26010 Corte De' Frati (CR) Italy","Paola Coppi, Sales ManagerSales Manager",+39 0372 93156
649,DOLCI PREZIOSI IBERICA,www.dolcipreziosi.es,"Avenida Barcelona, 109 Primera Planta 08970 Barcelona Spain","Claudia Ruiz Plaza, Responsible MarketingResponsible MarketingAlberto Castejon, Sales ManagerSales Manager",+34 934 314 168
650,DOMA S.R.L.,www.domabt.ro,"Catamaresti Deal, Str. Panselelor nr 11 Com. Mihai. Eminescu 717248 Botosani Romania","Gabriel Hutanu, AdministratorAdministratorMihaela Hutanu, Sales ManagerSales Manager",+40 231 517 075
651,DOMACO DR. MED. AUFDERMAUR AG,www.domaco.com,Weststrasse 16 5426 Lengnau Switzerland,"Bernhard Vogt, Head of Sales EuropeHead of Sales EuropeMarc Huber, Business Development ManagerBusiness Development Manager",+41 56 266 55 11
652,DOMENICO DE LUCIA S.P.A.,www.domenicodelucia.it,Via Maddaloni 3 81027 San Felice a Cancello (CE) Italy,"Domenico De Lucia, TitolareTitolarePino Falcone, Referente FiereReferente Fiere",+39 0823 802511
653,DOMUS VINI S.R.L.,www.domusvini.eu,Via Bigolo 26 35010 Fossalta di Trebaseleghe Italy,"Simone Gancitano, Export ManagerExport ManagerFilippo Dori, Legal RepresentativeLegal Representative",+39 0495796405
654,DONELLI VINI SPA,www.donellivini.it,Via Don Minzoni 1 42043 Gattatico (RE) Italy,"Giovanni Giacobazzi, PresidentPresidentAntonio Giacobazzi, Vice PresidentVice President",+39 0522 908715
655,DONGGUAN LIGHT SHINES ELECTRIC LIGHTING CO.,www.heutec-gmbh.de,"Room 101, Building 1, no.279 Hengli Donghuan Road, Hengli 523460 Dongguan China","Alfons Montag, Sales DirectorSales Director",+49 213 175 290 06
656,DOPLA S.P.A.,www.doplagroup.com,Via Nuova Trevigiana N. 126 31032 Casale sul Sile (TV) Italy,"Irene Casagrande, Sales ExecutiveSales ExecutiveEnrico Ceci, Consumer Business Sales DirectorConsumer Business Sales Director",+39 0422 388648
657,DORA UAB,www.themeatmakers.com,"Kauno 16 78104 Siauliai, Vilnius Lithuania","Aivaras Sakalas, Managing Director & Co-OwnerManaging Director & Co-Owner",+370 6825 4773
658,"DORCO CO., LTD.",www.dorco.co.kr,"36-9, Hyoryeong-ro 70-gil, Seocho-gu 06723 Seoul South Korea","Jason Ahn, Head of SalesHead of SalesLeandro Kim, Sales ManagerSales Manager",+82 2 585 4245
659,"DORDIV, S.L.",www.dordiv.com,"Polígono Industrial El Maigmo, Calle C 03109 Tibi, Alicante Spain","Marco Antonio Velázquez, CCOCCOMaria Carmen Fuentes Moratel, Chief Executive OfficerChief Executive Officer",+34 722864109
660,DOUKIDIS DAIRY PRODUCTS,www.doukidis.com,Industrial Area of Komotini 69100 Komotini Greece,"Stefanos Doukidis, Export ManagerExport ManagerMara Doukidi, Creative ManagerCreative Manager",
661,DOVES FARM FOODS,www.dovesfarm.co.uk,Salisbury Road RG170RF Hungerford United Kingdom,"Olivier Chereau, Export NAMExport NAM",+44 148 868 4880
662,DRAGON POLAND SP. Z O.O.,www.dragon.com.pl,St. Rtm. W. Pileckiego 5 30-050 Skawina Poland,"Sergiusz Twardowski, Export DirectorExport Director",+48 12625 75 78
663,DRAMERS S.A.,www.dramers.com.pl,"Rabowice, 38 Olszynowa Street 62-020 Swarzedz Poland","Dariusz Praczyk, Export ManagerExport ManagerLiliana Banach, Key Account ManagerKey Account Manager",+48 61 624 55 00
664,DREISTERN KONSERVEN GMBH & CO. KG,www.dreistern-gerichte.de,Philipp-Oehmigke-Straße 4 16816 Neuruppin am See Germany,"Leonard Lutz, Executive AssistantExecutive AssistantCelina Christiani, Executive AssistantExecutive Assistant",+49 1629184135
665,DR GERARD SP. Z O.O.,www.drgerard.eu,Radzyńska 9 21-560 Międzyrzec Podlaski Poland,"Andrzej Zielinski, International Sales DirectorInternational Sales Director",+48 22 722 46 46
666,DRYLOCK TECHNOLOGIES NV,www.drylocktechnologies.com,Spinnerijstraat 12 9240 Zele Belgium,"Bart Van Malderen, Chief Executive OfficerChief Executive Officer",+32 52 890 650
667,PT. DUA KELINCI,www.duakelinci.co.id,"Altira Business Park, Office Block A No. 11, 12 & 15 Jl. Yos Sudarso Kav. 85, Sunter 14350 Jakarta Utara Indonesia","Vincent Kohar, Deputy Export DirectorDeputy Export DirectorIndra Hermanto Irianto, Head of International SalesHead of International Sales",+62 212 6690206
668,DUBAI INDUSTRIES & EXPORTS,www.dedc.gov.ae,"Business Village Bloc A - 3rd Floor, Deira 123336 Dubai United Arab Emirates","Omar Alghfeli, Senior ManagerSenior ManagerAhmed Al Omari, DirectorDirector",+971 444 55333
669,DULCES Y CONSERVAS HELIOS S.A.,www.heliosesvida.es,Ctra. Salamanca 44 Arroyo de la Encomienda 47195 Valladolid Spain,"Jesús Díez, Export Area ManagerExport Area Manager",+34 983 40 78 49
670,DURSOL-FABRIK OTTO DURST,www.autosol.de,Martinstr. 22 42655 Solingen Germany,"Timm Jendras, Export ManagerExport Manager",+49 212 2718 0
671,DUTCH BAKERY GROUP B.V.,www.dutchbakery.nl,Kronosstraat 2 5048 CE Tilburg The Netherlands,"Monique van Deursen, Business Development ManagerBusiness Development ManagerRon Muijen, Chief Commercial OfficerChief Commercial Officer",+31 6 10002800
672,DYNAMIC WIPE INDUSTRIES LTD.,-,"9 Hathena Street, Industrial Park Hakala 77266 Ashdod Israel","Yaron Nakar, General ManagerGeneral ManagerAvi Lamdan, Sales and Marketing DirectorSales and Marketing Director",+972 8 852 3377
673,E. NEOPHYTOU TRADING CO. LTD.,www.serano.com.cy,"Trikomou 5, Dhali Industrial Area 2540 Nicosia Cyprus","Yiannos Neophytou, Commercial DirectorCommercial DirectorPambos Stylianides, Exports ManagerExports Manager",+35 722 433 685
674,E.U.D. GROUP A.S.,www.eudgroup.com,J. Palacha 121/08 69002 Breclav Czech Republic,"Marie Tomkova, Sales ManagerSales Manager",+420 519 325 598
675,EAST COAST BAKEHOUSE,www.eastcoastbakehouse.com,"Donore Road A92 DV76 Drogheda, Co. Louth Ireland","Peter Smart, Business Development ManagerBusiness Development ManagerRichard Boland, Commercial ManagerCommercial Manager",+353 124 40680
676,EAST MIDLANDS PHARMA LIMITED,www.empharma.co.uk,"Unit 2a, Old Dalby Business Park Old Dalby LE14 3NJ Leicestershire United Kingdom","Matthew Wood, Technical ManagerTechnical ManagerCharity Boyd, Administration AssistantAdministration Assistant",+44 1664820347
677,EASYFOOD A/S,www.easyfood.dk,Albuen 39 6000 Kolding Denmark,"Sebastian Weaver, Chief Commercial OfficerChief Commercial OfficerLene Barrit Arenholt, Marketing CoordinatorMarketing Coordinator",+45 76 308700
678,EAT BETTER S.R.L.,www.eatbetter.it,"Via Muzzioli 33/1 41121 Modena, MO Italy","Fabio Cavicchioli, President and Chief Executive OfficerPresident and Chief Executive OfficerGreta Zuccheri, Sales DepartmentSales Department",+39 059 4396459
679,EAT THE BALL HOLDING GMBH,www.eattheball.com,Karolingerstraße 3 A 5020 Salzburg Austria,"Markus Wenninger, Head of Sales & Business DevelopmentHead of Sales & Business DevelopmentBettina Maggauer, Inside Sales & Logistics CoordinatorInside Sales & Logistics Coordinator",+43 664 815 2005
680,EAZ PAC AB,www.eazpac.com,S:t Johannesgatan 2 4th Floor 21146 Malmö Sweden,"Jakob Larsson, Chief Executive OfficerChief Executive Officer",+46 708 326 784
681,EBNAT AG,www.ebnat.ch,Industriestrasse 34 9642 Ebnat-Kappel Switzerland,"Peter Langenegger, Marketing and Sales Manager Oral CareMarketing and Sales Manager Oral CareAlessandro Poncioni, Key Account ManagerKey Account Manager",+41 71 992 62 62
682,ECC ECOLOGICAL CLEANING AND CARE GMBH,www.ecc-kompetenz.com,Kreuzberger Ring 7a 65205 Wiesbaden Germany,"Jörn Herrmann, DirectorDirector",+49 6131 964 2577
683,ECLOR,www.groupe-eclor.com,20 rue Rouget de Lisle 92130 Issy les Moulineaux France,"Gözde Capulli, Chef de Produit Senior InternationalChef de Produit Senior InternationalMarion Colombié, International Product ManagerInternational Product Manager",+33 171 10 72 33
684,ECOCLAVIS,www.ecoclavis.com,"Gagelstraat, 2 8200 Sint-Andries Belgium","Pierre Kemseke, Chief Executive OfficerChief Executive Officer",+32 479620171
685,ECOFROST SA,www.ecofrost.be,Rue de l'Europe 34 7600 Peruwelz Belgium,"Sabine De Fauw, Sales ResponsableSales ResponsableClaire Hoflack, Sales ResponsableSales Responsable",+32 69 36 29 40
686,ECZACIBASI TÜKETIM ÜRÜNLERI SAN. VE TIC. A.S.,www.eczacibasi.com.tr,Rüzgarlı Bahçe Mah. Çam Pinarı Sok Eczacıbaşı Blok No.3 34805 Istanbul Turkey,"Erdinç Çokberkit, Business Development ManagerBusiness Development Manager",+90 533 613 28 23
687,EDPOL FOOD & INNOVATION SP. Z O.O.,www.edpolfood.com,Ul Nowogrodzka 155a 18-400 Lomza Poland,"Julia Augustyniak, Export ManagerExport ManagerGeorgina Dabrowska, Export ManagerExport Manager",+48 86 218 30 32
688,EDULAB,www.edulab.pt,"Avenida de Moçambique, Lote 113 C - Vila Amélia 2950-805 Quinta do Anjo Portugal","Helder Nabais, General ManagerGeneral ManagerFilomena Parreira, Managing PartnerManaging Partner",+351 212 107 740
689,AS EESTI PAGAR,export.eestipagar.ee,Tööstuse 34 72720 Paide Estonia,"Aleksei Mogutov, Export ManagerExport ManagerMerike Adamson, Export Key Account ManagerExport Key Account Manager",+372 384 9260
690,EFFECTIVEAT LTD,www.effectiveat.co.il,"Industrial Area, Sagie 2000 PO Box 3143 30095 Ramat Yishay Israel","Ofer Ben David, Chief Executive OfficerChief Executive OfficerNatali Medan, Food EngineerFood Engineer",+972 48425588
691,EGEMEN GROUP,www.magicsaverbag.com,"7234 Sk. No. 2/a Gurpinar Mah 35060 Bornova, Izmir Turkey","Cagdas Derin, Export and Import ManagerExport and Import ManagerOrkun Behlul, Export Area Sales ChiefExport Area Sales Chief",+90 232 437 3205
692,EGGELBUSCH GMBH & CO. KG,www.eggelbusch.de,In Der Heide 20 33428 Harsewinkel Germany,"Melanie Klein, Sales AssistantSales AssistantSnezana Schuermann, ManagerinManagerin",+49 2588 93000
693,EGGER GETRÄNKE GMBH & CO OG,www.eggergetraenke.at,Tiroler Straße 20 3105 Unterradlberg Austria,"Markus Waldbauer, Head of Sales EuropeHead of Sales EuropeLisa Speiser, Sales Support ManagerSales Support Manager",+43 50300
694,EGIDNA SRL,www.egidna.it,Via Dell'Artigianato 33 35010 Villa Del Conte Italy,"Devis Sartor, Chief Executive OfficerChief Executive OfficerVeronika Mazzonetto, Office Marketing and Public RelationsOffice Marketing and Public Relations",+39 0499325327
695,EGI GROUP SH.P.K.,www.egigroup-ks.com,Zahaq 35 30000 Pejë Kosovo,"Argezon Havolli, General DirectorGeneral Director",+383 49709433
696,EHRMANN GMBH OBERSCHÖNEGG IM ALLGÄU,www.ehrmann.de,A.-Ehrmann-Straße 2 87770 Oberschoenegg Germany,"Sabrina Schuster, Product ManagerProduct ManagerLilian Mareis, Product ManagerProduct Manager",+49 8333 301 0
697,EISBÄR EIS GMBH,www.eisbaer-eis.de,Eisbärstraße 1 21641 Apensen Germany,"Christoph Ruehs, Sales ManagmentSales ManagmentMartin Ruehs, Managing DirectorManaging Director",+49 4167 9123 0
698,EKAF S.P.A.,www.cellinicaffe.com,Lungotorrente Secca 3R 16163 Genova Italy,"Mauro Gargioni, Sales ManagerSales ManagerAlberto Pieri, Marketing ManagerMarketing Manager",+39 010 716 541
699,EKIBIO,www.ekibio.fr,ZA La Boissonnette 07340 Peaugres France,"Olivier Perreol, Export ManagerExport ManagerDavid van de Gehuchte, Sales and Marketing ManagerSales and Marketing Manager",
700,EKKO LT,www.ekko.lt/en,Raudondvario K. 1 32101 Zarasu r. Lithuania,"Kristijonas Brusokas, Export ManagerExport ManagerAurimas Bagdanavicius, DirectorDirector",+370 860842859
701,EKO-VIT SP. Z O.O.,www.eko-vit.pl,Ul. Techniczna 16/18 92-518 Lódz Poland,"Robert Jaruga, PresidentPresidentKamil Cendrowski, Export DirectorExport Director",+48 42 649 3000
702,EKOFRISA UAB,www.ekofrisa.lt,Plento Str. 39 Naraukelis Village 59272 Prienai District Lithuania,"Ieva Ragauskiene, Sales Project ManagerSales Project ManagerLina Duzinskiene, Chief Executive OfficerChief Executive Officer",+370 68640735
703,"EKOFRUKT SLANY, SPOL. S.R.O.",www.ekofrukt.cz,Trojanova 1566 27401 Slaný Czech Republic,"Tomas Richtr, Export ManagerExport Manager",+420 728345284
704,EKO PIRK,www.amritawholesale.com,Mokslininku Str. 6A 08412 Vilnius Lithuania,"Anita Puzonaite, DirectorDirectorAgne Mileryte, Export Project ManagerExport Project Manager",+370 655 71136
705,ELABORADOS NATURALES DE LA RIBERA S.L.,www.elaboradosnaturales.com,Pol. Ind. Bodega Romana 31360 Funes Spain,"Javier Adan, Sales DirectorSales DirectorCid Peña, Export DirectorExport Director",+34 664286948
706,ELBAK S.A. - GREEK CANNING INDUSTRY,www.elbak.gr,"5,5 km Road Larissa - Falani 41110 Larissa Greece","Panayiotis Fronimos, General ManagerGeneral ManagerTheodoros Gouveris, Commercial ManagerCommercial Manager",+30 2410 549550
707,ELBISCO INDUSTRIAL & COMMERCIAL FOOD S.A.,www.elbisco.gr,"21st Km Marathonos Avenue 19009 Pikermi, Attica Greece","Vangelis Glavas, Export ManagerExport Manager",+30 210 6039712
708,ELBURG FOODS,www.elburgfoods.eu,J.P. Broekhovenstraat 2-6 8081 HC Elburg The Netherlands,"Vadim Esajan, SalesSalesHans ter Maten, Managing DirectorManaging Director",+31 525 690 009
709,ELEONES OF CHALKIDIKI S.A.,www.olive.gr,9th km Thessaloniki Neochorouda Ionia Thessaloniki 57008 Thessaloniki Greece,"Spyridon Georgiadis, Sales ManagerSales Manager",+30 2310 784 529
710,ELFA PHARM SP. Z O.O.,www.elfapharm.pl,Chociw 99 98-170 Widawa Poland,"Robert Miniak, PresidentPresidentOleksiy Krylov, DirectorDirector",+48 60 550 6606
711,ELGORRIAGA BRANDS S.A.,www.chocolateselgorriaga.com,Ctra N 110 Km 259 05002 Avila Spain,"Sara Perez, Export Area ManagerExport Area Manager",+34 920352052
712,ELIF FOODS,www.eliffoods.nl,Engeveldweg 6 6904 GM Zevenaar The Netherlands,"Gamze Kablan, Sales ManagerSales Manager",+31 6 319934943
713,ELIF PLASTIK AMBALAJ SAN. VE TIC. A.S.,www.elif.com,Orhangazi Mahallesi 1652 Sokak No:2 Esenyurt 34538 Istanbul Turkey,"Orcun Buldan, Senior Marketing SpecialistSenior Marketing Specialist",+90 212 622 0622
714,ELISA FOOD S.R.L.,www.elisa-food.com,Via C.m. Ricotti 2 28100 Novara Italy,"Edoardo Fasce, Company OwnerCompany OwnerClemente Fasce, Company OwnerCompany Owner",+39 0321 885 209
715,ELITE NATUREL,www.elitenaturel.com,Mustafa Kemal Mah 2159 Sok. 6/8 Sogutozu 06520 Ankara Turkey,"Namlu Besne, Export ManagerExport ManagerHandan Turna, Business DevelopmentBusiness Development",+90 312 2198095
716,ELIZA CHOKOLADE APS,www.elizachokolade.dk,Jens Juuls Vej 40 8260 Viby Denmark,"Helle Renevald, Chief Executive OfficerChief Executive OfficerLykke Hilfeldt, Product ManagerProduct Manager",+45 86130001
717,ELSDORFER MOLKEREI UND FEINKOST GMBH,www.elsdorfer.de,Molkereistr. 6 27404 Elsdorf Germany,"Holger Battling, Managing DirectorManaging DirectorMelih Cap, Key Account Manager ExportKey Account Manager Export",+49 4286 93000
718,ELTAR SP. Z O.O.,www.eltar-targi.com.pl,"Ul. Garibaldiego 4, Lok. 18a 04-078 Warsaw Poland","Beata Kamieniec, President of the BoardPresident of the BoardMarta Sarnowska, Member of the BoardMember of the Board",+48 22 617 33 23
719,EMBASSY OF INDONESIA,www.indonesia.nl,Tobias Asserlaan 8 2517 KC The Hague The Netherlands,"Sabbat Christian Jannes, Trade AttachéTrade AttachéNa Kin San, Staff of the Trade AttachéStaff of the Trade Attaché",+31 70 3108171
720,EMBUTIDOS GOIKOA S.A.,www.goikoa.com,Avda. P. Raimundo de Lumbier 8 31400 Sangüesa Spain,"Ana Sola, Export ManagerExport ManagerAnita Künsztler, Export AssistantExport Assistant",+34 948 871 423
721,EMCO SPOL. S.R.O.,www.emco.eu,Türkova 2319/5b 149 00 Prague 4 Czech Republic,"Ludek Spejzl, Export DirectorExport DirectorTereza Skopanova, Export Executive ManagerExport Executive Manager",+420 277 004 758
722,EMILIA FOODS SRL SOCIETÀ UNIPERSONALE,www.emiliafoods.it,Via Emilia Est 903 41122 Modena Italy,"Ivan Manfredi, Founder and Chief Executive OfficerFounder and Chief Executive OfficerGiulia Galesi, Sales DepartmentSales Department",+39 053 6941714
723,EMILIANA CONSERVE SOC. AGR. SPA,www.emilianaconserve.it,Via Vivaldi n.7 43011 Busseto (PR) Italy,"Gian Mario Bosoni, Chief Executive OfficerChief Executive OfficerNicolò Moruzzi, Sales ManagerSales Manager",+39 0524 91742
724,EMILIO MAURI SPA,www.mauri.it,Via Provinciale 11 23818 Pasturo Italy,"Rossana Pomi, Export Area ManagerExport Area Manager",+39 0341955700
725,"EMILIO MIRÓ SALVAT, S.A",www.vermutmiro.com,Carrer Adrià Gual 10 43206 Reus Spain,"Laura Prats, Commercial DirectorCommercial DirectorÀngels Mulé, Operations DirectorOperations Director",+34 977 312 958
726,EMIRATES STEEL WOOL MANUFACTURING EST.,www.eswhome.com,P.O. Box 277 Abu Dhabi United Arab Emirates,"Saeed Al Askari, DirectorDirectorJafar Al Askari, DirectorDirector",+971 2 555 4544
727,EMIX,www.emix.com.pl,Rusinowo 73 87-500 Rypin Poland,"Aleksander Kaleta, Vice President, Commercial DirectorVice President, Commercial DirectorMarek Gorczewski, Export ManagerExport Manager",+48 54 280 2013
728,EMMI DESSERT ITALIA S.P.A.,www.emmidessert.it,Via Cascinetta 44 28013 Gattico-Veruno (NO) Italy,"Alessandra Brovelli, Marketing AssistantMarketing AssistantPeter Irle, Chief Executive OfficerChief Executive Officer",+39 0322 1918163
729,EMMI SCHWEIZ AG,www.emmi-industrie.com,Landenbergstrasse 1 6005 Luzern Switzerland,"Philippe Minder, Head of B2BHead of B2BFabienne Lier, Business Development ManagerBusiness Development Manager",+41 582 275 221
730,EMPIRE TEAS (PVT) LTD.,www.empireteas.com,"190/1 Siri Sumana Mw, Kelanimulla 10620 Angoda Sri Lanka","Sahampathy Dissanayake, General Manager - MarketingGeneral Manager - MarketingDilan Karunatilake, Regional ManagerRegional Manager",+94 112 549 001
731,EMPRESAS CAROZZI S.A.,www.carozzicorp.com,Av Diego Portales 5201 832 0000 Santiago Chile,"Pablo Villalobos, Export ManagerExport Manager",+56 956005200
732,EMPWR BV,www.empwrnutrition.com,Sluisweg 2/11 9000 Ghent Belgium,"Jan-Pieter Blanckaert, International Sales ManagerInternational Sales ManagerGerd Gossye, Commercial DirectorCommercial Director",
733,ENCLAVER S.N.C. DI ALESSIO GABRIELE & C.,www.enclaver.it,Corso Re Umberto 98 10128 Torino Italy,"Gabriele Alessio, Owner, AdministratorOwner, Administrator",+39 347 384 2632
734,ENDEKS KIMYA SAN. VE TIC. A.S.,www.endekskimya.com,Adnan Kahveci Mah. Davutpasa Cad. No:17 Beylikduzu 34528 Istanbul Turkey,"Muhammet Fatih Ender, Export Area ManagerExport Area Manager",+90 530 963 4991
735,ENGEL FOOD SOLUTIONS,www.engel-fs.de,Klever Strasse 48 47574 Goch Germany,"Anne Masteau, Sales and Marketing DirectorSales and Marketing Director",+49 2823 109 810
736,ENGEL FOREIGN FOOD B.V.,www.tropicalworldfood.com,Wiegerbruinlaan 4D 1422 CB Uithoorn The Netherlands,"Laurens ten Feld, International Sales and Marketing DirectorInternational Sales and Marketing DirectorLee Nah Lim, Export ManagerExport Manager",+31 297 533 833
737,ENKA HIJYEN ÜRÜNLERI SAN. VE TIC. A.S.,www.enkahijyen.com,"5. OSB 83535 Nolu Cad. No:15 27120 Sehitkamil, Gaziantep Turkey","Mehmet Dogan Mazicioglu, Member of the BoardMember of the BoardAhmet Nuri Tekerekoglu, Sales ExecutiveSales Executive",+90 342 290 1111
738,ENNSTAL MILCH KG,www.ennstalmilch.at,Bahnhofstrasse 182 8950 Stainach-Puergg Austria,"Nicole Berger, International Sales ManagerInternational Sales ManagerElisa Buchgraber-Svatek, Marketing ManagerMarketing Manager",+43 3682 285 5934
739,ENRICO B.V.,www.enrico.nl,Rijnkade 8 1382 GS Weesp The Netherlands,"Peter Boer, Commercial DirectorCommercial DirectorLisette Beets, Account ManagerAccount Manager",+31 88 20 60 500
740,ENTERPRISE GREECE S.A.,www.enterprisegreece.gov.gr,109 Vasilisis Sophias Avenue 11521 Athens Greece,"Froso Zogopoulou, Project ManagerProject Manager",+30 210 335 5795
741,ENTERPRISE LITHUANIA,www.enterpriselithuania.com,A. Gostauto Str. 40A 03163 Vilnius Lithuania,"Renata Nedzinskiene, Head of Team, Export DepartmentHead of Team, Export Department",+370 5249 90 83
742,ENTREMONT,www.sodiaal.fr,25 Faubourg Des Balmettes 74000 Annecy France,"Hassan El Bouazzaoui, Key Account ManagerKey Account Manager",+32 4 75 85 13 41
743,QUESERÍAS ENTREPINARES SAU,www.entrepinares.es,Avenida de Santander 140 Pol. Ind. Las Arenas 47011 Valladolid Spain,"Carmen Gonzalez, Export Area ManagerExport Area ManagerDaniel Celada Elices, Técnico de MarketingTécnico de Marketing",+34 983 45 77 25
744,D. ENTRUP-HASELBACH GMBH & CO. KG,www.deh.de,Alte Geer 8 58285 Gevelsberg Germany,"Johanna Isabella Kubatty, MarketingMarketingAlexander Haselbach, Geschäftsführer VertriebGeschäftsführer Vertrieb",+49 2332 7576 0
745,EPILOV,www.epilov.com,16 Rue des Suisses 92380 Garches France,"Michel Favier, PresidentPresident",+33 621 392 581
746,ERBACHER FOOD INTELLIGENCE GMBH & CO. KG,www.food-intelligence.de,Im Steiner 2-4 63924 Kleinheubach Germany,"Gaby Kupfer, Key Account ManagerKey Account ManagerJana Seifert, MarketingMarketing",+49 9371 940 0
747,ERBENOBILI SRL,www.erbenobili.com,C.da Torre Pavone Z.I. 70033 Corato Italy,"Vito Cannillo, Export ManagerExport ManagerDomenico Cannillo, Chief Executive OfficerChief Executive Officer",+39 0808723739
748,ERC TRADE,www.erctrade-ks.com,"Mallakastra, Bardhosh 10000 Prishtine Kosovo","Arben Arifi, Chief Executive OfficerChief Executive OfficerAvni Arifi, International Sales and Marketing ManagerInternational Sales and Marketing Manager",+383 44500569
749,EREGLI AGROSAN AS,www.eregliagrosan.com,Esentepe Mah. Kelebek Cikmazi Sk. Bil Apt. No:3/3A Sisli 34200 Istanbul Turkey,"Gözde Sakir, Business Development SpecialistBusiness Development SpecialistCan Satvan, Deputy ManagerDeputy Manager",+90 530 425 3452
750,ERES-SAPOLI NV,www.eres-sapoli.be,Tulpenstraat 6 9810 Eke Belgium,"Nico Delft, Managing DirectorManaging Director",+32 9 385 59 11
751,ERHARD PATISSIER GLACIER,www.erhard-desserts.com,7 rue du Stade 68290 Masevaux France,"Guy Haffner, General DirectorGeneral Director",+33 3 89 38 07 50
752,ERKUL KOZMETIK A.S.,www.goldenrose.com.tr,Cihangir Mah. Petrol Ofisi Cd. No1 34310 Istanbul Turkey,"Saadet Ertekin, Private Label ManagerPrivate Label ManagerUgur Adiyaman, Export ManagerExport Manager",+90 212 456 53 00
753,ERTE KOZMETIK SAN. VE TIC. A.S.,www.ertecosmetics.com,Cihangir Mahallesi Güvercin Caddesi No:1 Avcılar 34310 Istanbul Turkey,"Nurgul Konuk Yilmaz, Head of Private LabelHead of Private LabelAli Cerid, Purchasing ManagerPurchasing Manager",+90 212 875 81 82
