,Company Name,Comapany Website,Address,Contact,Phone No.
1768,PASTIFICIO DI MARTINO GAETANO & F.LLI SPA,www.pastadimartino.it,Via Castellammare 82 80054 Gragnano Italy,"Giusy Amore, Export ManagerExport Manager",+39 081 80 12984
1769,PASTIFICIO NOVARESE MARIO S.R.L.,www.pastificionovarese.it,Via Dei Castagni 13 37141 Verona Italy,"Consuelo Pesaro, Export ManagerExport ManagerZeno Rama, Sales ManagerSales Manager",+39 045 557036
1770,PATATAS FRITAS TORRES S.L.,www.justthis-snacks.com,"Verneda Del Congost, 4 Pol. Ind. El Pedregar 08160 Montmeló Spain","Gilles Laporte, International Sales ManagerInternational Sales Manager",+34 937919461
1771,PATISSERIE ALSACIENNE BLOCH NV,www.bloch1899.be,Houtstraat 46 9070 Destelbergen Belgium,"Werner Nies, Chief Executive OfficerChief Executive OfficerFrederik Van Nuffel, Business Development ManagerBusiness Development Manager",+32 9 229 05 11
1772,PATISSERIE DES FLANDRES,www.lagaufre.fr,235 Rue du Meunier ZI du Moulin 59193 Erquinghem-Lys France,"Benoit Rousseau, Chief Executive OfficerChief Executive OfficerStéphanie Potdevin, Export Business DeveloperExport Business Developer",+33 3 20 35 42 57
1773,PÂTISSERIE LES COMTES DE LA MARCHE SAS,www.maisonjacquemart.com,La Goutte 23230 La Celle-sous-Gouzon France,"Nawal Chebout, Export Sales RepresentativeExport Sales Representative",
1774,PATISSERIES GOURMANDES S.A.S,www.patisseriesgourmandes.com,36 Rue du Bourgeon 22600 Loudéac France,"Myriam Betus, Export DirectorExport DirectorXavier Bertin, Directeur de la Business Unit SurgelésDirecteur de la Business Unit Surgelés",+33 296 66 17 17
1775,C. E. PATTBERG GMBH + CO. KG,www.pattberg.com,Heiskampstrasse 12 45527 Hattingen Germany,"Klaus Exner, Sales Director ExportSales Director Export",+49 2324 390168
1776,PAUL HEUMANN SA,www.heumann.fr,"42 A Rue de Lobsann, BP 70005 67250 Soultz-Sous-Fôrets France","Isabelle Heumann, Chief Executive OfficerChief Executive OfficerNathalie Michael, Sales ManagerSales Manager",+33 3 88 80 40 61
1777,PAUWELS N.V.,www.pauwels-sauces.com,Vaartstraat 176 2520 Ranst-Oelegem Belgium,"Mark Cardon, Commercial ManagerCommercial ManagerCharles Van Damme, Managing DirectorManaging Director",+32 3 475 04 75
1778,P. PAVLIDES S.A.,www.pavlides-group.gr,2nd Km Giannitsa-Edessa 58100 Giannitsa Greece,"Dimitra Christidou, Export ManagerExport Manager",+30 23820 83590
1779,PAW SP. Z O.O.,www.paw.net.pl,Ul. Nektarowa 9 62-002 Suchy Las Poland,"Jurgita Zablocka, Head of Export DepartmentHead of Export DepartmentMiriam Fernandez-Drozdowska, Export ManagerExport Manager",+48 618115565
1780,PEARL GROUP CORPORATION,www.vietnampepper.vn,"147 Quoc Lo 13 Street, Ward 26 Binh Thanh District 700000 Ho Chi Minh Vietnam","Prasad Hari Parlakot, Sales ManagerSales ManagerHop Pham Thanh, Sales DirectorSales Director",+84 2837272426
1781,PEDON S.P.A.,www.pedon.it/en,Via del Progresso 32 36064 Colceresa (VI) Italy,"Matteo Merlin, Marketing DirectorMarketing DirectorPaolo Pedon, Export DirectorExport Director",+39 0424 411125
1782,PEKAR D.O.O.,www.pekar.hr,Obrtnicka 5 32100 Vinkovci Croatia,"Domagoj Radic, Chief Executive OfficerChief Executive OfficerSnježana Kukec, Export ManagerExport Manager",+385 32 341 227
1783,PEKARNA PECJAK D.O.O.,www.pekarna-pecjak.si,Dolenjska Cesta 442 1291 Skofljica Slovenia,"Simon Kenda, Area Sales ManagerArea Sales ManagerAnton Hocevar, Project ManagerProject Manager",+386 15304509
1784,PELLEFOOD LTD.,www.pellefood.com,Building 948 2512000 Kabri Israel,"Or Shiron, Export ManagerExport ManagerOpal Belson, Factory ManagerFactory Manager",+972 545888999
1785,PELOPAC MEDITERRANEAN FOOD SPECIALTIES,www.pelopac.gr,P.O. Box 1298 Thessaloniki Industrial Area 57022 Thessaloniki Greece,"Elke Veenendaal, Business DevelopmentBusiness DevelopmentThemis Athanasiadis, Business DevelopmentBusiness Development",+30 2310 754050
1786,PERANO ENRICO & FIGLI SPA,www.galletto-conserve.it,Via A. Diaz 68 84010 San Valentino Torio (SA) Italy,"Willy De Luca, Export ManagerExport ManagerEnzo Perano, DirectorDirector",+39 081 939418
1787,PEREJA ILERI KIMYA SAN A.S.,www.pereja.com.tr,"Oruc Reis Mah. Tekstilkent Koza Plaza A Blok Kat:7 No:28 34220 Esenler, Istanbul Turkey","Ismail Susesi, ChairmanChairmanAltan Eplek, Deputy General ManagerDeputy General Manager",+90 212 855 7979
1788,"PERFUMS BACHS, S.A.",www.perfumsbachs.com,Alacant 21 17005 Girona Spain,"Josep Alcon, Export ManagerExport ManagerDaniel Bachs, Chief Executive OfficerChief Executive Officer",+34 972 231 711
1789,PERI-DENT LTD.,www.perident.co.uk,"1st Floor, Suite 3, Anderson Chambers Market Street TD1 3AF Galashiels United Kingdom","Nicola Porterfield, Account ManagerAccount ManagerGary Butler, Managing DirectorManaging Director",+44 1896 754 400
1790,PERLA DEUTSCHLAND GMBH,www.perlaeurope.com,Brandensteinweg 6 13595 Berlin Germany,"Michael Perel, GeschäftsführerGeschäftsführerDariusz Rejmak, Key Account InternationalKey Account International",+48 795 400 159
1791,PERLA DI SEPERTINO EUGENIA & C. SNC,www.marenchino.it,Via Martiri delle Foibe 11 12038 Savigliano Italy,"Simone Marenchino, Export ManagerExport Manager",+39 017221724
1792,PERNES L LTD.,www.longchips.eu,Cipsi 2105 Pernciems Latvia,"Kristaps Radzins, Managing DirectorManaging DirectorLaimonis Radzins, President and Chief Executive OfficerPresident and Chief Executive Officer",+371 28 66 28 62
1793,PERNIK S.R.O.,www.pernik-sro.cz,Techlovice 130 503 27 Lhota pod Libcany Czech Republic,"Martina Králová, ExecutiveExecutiveBarbora Behanová, Export ManagerExport Manager",+420 727 802 437
1794,PERSEIDA BELLEZA S.L.,www.perseida.com,"Polígono Industrial El Pabellón S/N 06380 Jerez de los Caballeros, Badajoz Spain","Isabel Rubio Galván, General ManagerGeneral ManagerIgnacio Córdoba Pérez, Sales ManagerSales Manager",+34 924 750 512
1795,PERSONNA INTERNATIONAL CZ S.R.O.,www.personna.com,Katerinská 96 417 42 Krupka Czech Republic,"Alessandro Camussa, European Marketing DirectorEuropean Marketing Director",+420 417 637 378
1796,"PESITRO HEALTHCARE PRODUCTS CO., LTD.",www.pesitro.com,"8 Tongzhou Rd., Hangji Town 225111 Yangzhou China","Julio Felippe Bicudo, International Sales DirectorInternational Sales DirectorJoseph Zhang, Managing DirectorManaging Director",+86 514 8978 6471
1797,PETCOM TIERERNÄHRUNG GMBH & CO. KG,www.petcom.de,Hans-Böckler Str. 26 32423 Minden Germany,"Cindy Heloir, Intern SalesIntern SalesJonas Kathmann, VertriebsassistentVertriebsassistent",+49 571 38710 95
1798,PETER PAN PLAST SRL,www.peterpanplast.com,Via Stefano Carli 3-5A-5B 36027 Rosà (Vicenza) Italy,"Christian Remonato, General ManagerGeneral ManagerMichela Adda, Export and Quality ManagerExport and Quality Manager",+39 0424 581445
1799,PETERS KRIZMAN AG,www.peterskrizman.com,Schweizergasse 20 8001 Zurich Switzerland,"Albert Peters, Director Business DevelopmentDirector Business DevelopmentAnya van Brenk, Account ManagerAccount Manager",+41 442 100 203
1800,PETRI FEINKOST GMBH & CO. KG,www.petrella.de,Claus-Petri-Straße 3 31868 Ottenstein / Glesse Germany,"Stefan Zimmer, General ManagerGeneral ManagerRon Velden, Key Account ExportKey Account Export",+49 5286 98000
1801,PETROU BROS DAIRY PRODUCTS LTD,www.petroubros.com.cy,25 Pindarou Avenue 7100 Larnaca Cyprus,"Michael Petrou, Commercial ManagerCommercial ManagerGeorge Petrou, General ManagerGeneral Manager",+357 24661210
1802,"PETRUZ FRUITY INDÚSTRIA, COMERCIO E DISTRIBUIDORA LTDA",www.petruz.com,"Rua Duque De Caxias, 250 68.741-360 Castanhal Brazil","Izabella Bihl, Market DevelopmentMarket DevelopmentRicardo Bihl, Market DevelopmentMarket Development",+55 913 7215562
1803,PETSELECT S.A.,www.petselect.eu,Baiuca 15940 A Pobra Do Caramiñal Spain,"Lucia Outeiral, AdministrationAdministrationAlberto Parada Quintana, Sales Director Retailer BrandsSales Director Retailer Brands",+34 981832260
1804,HERMANN PFANNER GETRÄNKE GMBH,www.pfanner.com,Alte Landstrasse 10 6923 Lauterach Austria,"Peter Pfanner, General ManagerGeneral ManagerJosef Pfingstl, Head of CopackingHead of Copacking",+43 5574 6720 126
1805,G. PFITSCHER GMBH,www.pfitscher.info,Romstrasse 20 39014 Burgstall Italy,"Lukas Pfitscher, Chief Executive OfficerChief Executive OfficerPatrick Lochmann, Sales ManagerSales Manager",+39 0473292358
1806,PHARMAPLAST,www.pharmaplast-online.com,Amria Free Zone 23512 Alexandria Egypt,"George Magdy Fahmy Khalil, Sales ManagerSales ManagerKamilia Gad, Sales AssistantSales Assistant",+20 345 002 64
1807,PHAT FOOD INTELLIGENCE,www.phatcorps.com,"132 Room 4104, Phaholyothin 69 Rd. Anusaowaree Bangkean 10220 Bangkok Thailand","Prangsiri Mesamarn, Deputy Managing DirectorDeputy Managing DirectorIdthipol Patimavirujh, Managing DirectorManaging Director",+66 62 875 9911
1808,PIASTEN GMBH,www.piasten.de,Piastenstr. 1 91301 Forchheim Germany,"Donald Grahl, Export ManagerExport Manager",+49 9191 611 0
1809,PICKENPACK SEAFOODS GMBH,www.pickenpackseafoods.com,Universitätsallee 15 21335 Lüneburg Germany,"Andrew Fairbairn, Export DirectorExport DirectorFrank Klintworth, Sales DirectorSales Director",+49 4131 77 77 0
1810,PIEKARNIA GALICYJSKA SP. Z O.O.,www.galicia.com.pl,Masarska 10a 39-100 Ropczyce Poland,"Patrycja Marchut, Export SpecialistExport SpecialistKrzysztof Krecichwost, Chief Executive OfficerChief Executive Officer",+48 5022 6280 6
1811,PIERRE LE BLANC B.V.,www.pietdewitsnacks.nl,Aluminiumstraat 84 2718 RA Zoetermeer The Netherlands,"Jeroen Buis, Chief Commercial OfficerChief Commercial OfficerPaul van Rijn, Chief Executive OfficerChief Executive Officer",+31 79 3632040
1812,PIETERCIL DELBY'S N.V.,www.pietercil.com,Vitseroelstraat 74 1740 Ternat Belgium,"Guy Coppens, Division ManagerDivision ManagerLuk De Brauwer, Key Account Manager ExportKey Account Manager Export",+32 2 583 81 00
1813,PIK BECEJ AD,www.florafoods.rs,Novosadska Ulica 155 21220 Bečej Serbia,"Milos Mijovic, Chief Executive OfficerChief Executive OfficerZoran Krunic, Chief Commercial OfficerChief Commercial Officer",+381 648 265 835
1814,PINSON BISCUITERIE BVBA,www.pinsonbiscuits.be,Handelsstraat 11 8630 Veurne Belgium,"Karien De Zaeyer, AdministrationAdministrationErik Pinson, DirectionDirection",+32 058311210
1815,PINZGAU MILCH PRODUKTIONS GMBH,www.pinzgaumilch.at,Saalfeldnerstrasse 2 5751 Maishofen Austria,"Martin Papik, Key Account ManagerKey Account ManagerBenjamin Enzinger, Key Account ManagerKey Account Manager",+43 6542 68266 330
1816,PIP D.O.O.,www.tmex.rs,Tekelijina 43 21000 Novi Sad Serbia,"Branislava Dabic, Marketing ManagerMarketing ManagerNemanja Cobanov, Sales and Marekting DirectorSales and Marekting Director",+381 603 203 608
1817,PIRAMIDA 72 D.O.O.,www.piramida72.com,Beogradski put bb 15000 Sabac Serbia,"Vladimir Grujicic, General ManagerGeneral ManagerBranislav Grujicic, Export ManagerExport Manager",+381 608 231 811
1818,PISKAR D.O.O.,www.piskar.si,Sneberska cesta 138 B 1260 ǈubljana-Polje Slovenia,"Uros Piskar, Sales DirectorSales DirectorAnton Piskar, Chief Executive OfficerChief Executive Officer",+386 1 520 6600
1819,PITA-BAKKERIJ CAIRO B.V.,www.pitta.nl,Bijsterhuizen 51-23 6604 LX Wijchen The Netherlands,"Ruud Salari, General ManagerGeneral Manager",+31 24 642 4922
1820,PITTMAN SEAFOODS,www.pittmanseafoods.com,Noordzeestraat 2 8380 Zeebrugge Belgium,"Thomas Vantieghem, Key Account Manager RetailKey Account Manager Retail",+32 50 55 14 58
1821,PLANTA GMBH,www.planta.as,Wördeländer Strasse 71a 17389 Anklam Germany,"Markus Wissing, Sales DirectorSales Director",+49 170 555 5203
1822,PLANTIN SA,www.truffe-plantin.com,Route de Nyons 84110 Puyméras France,"Jean-Baptiste Delteil, Marketing ManagerMarketing Manager",+33 4 90 46 41 44
1823,PLANT REPUBLIC GMBH,www.plant-republic.eu,Wiesingerstraße 6/14a 1010 Vienna Austria,"Claudia Peischl, Sales DirectorSales DirectorMatthias Krön, General ManagerGeneral Manager",+43 664 1622784
1824,PLASFESA PRODUCTS S.L.,www.fliss.es,Pol. Ind. El Brosquil 46780 Oliva Spain,"Vicent Fenollar, Chief Executive OfficerChief Executive Officer",+34 677578975
1825,PLASPAK PLASTIK VE AMBALAJ SANAYI VE TICARET A.S.,www.plaspak.com,Sehit Muhtar Cad 17/6 34437 Istanbul Turkey,"Sinan Gülener, General ManagerGeneral Manager",+90 2122355953
1826,"PLASTDIVERSITY, LDA",www.plastdiversity.com,"Rua dos Alentojeiros 136, Ap. 4 3091-902 Marinha das Ondas Portugal","Ricardo Fonseca, Sales, Development, MarketingSales, Development, Marketing",+351 233 959 490
1827,PLATVIS HOLLAND B.V.,www.platvis.nl,Hamerstraat 7 1135 GA Edam The Netherlands,"Risko van Dasler, Sales ManagerSales ManagerRoland van Dasler, Commercial DirectorCommercial Director",+31 299 374 375
1828,PLAZA FOOD B.V.,www.plazafoods.com,Oostkanaaldijk 112 6534 AL Nijmegen The Netherlands,"Deborah Gardeniers, Senior Sales ManagerSenior Sales ManagerJack Chang, General ManagerGeneral Manager",+31 24 747 0012
1829,PLMA,www.muesligraci.com,Rigas gatve 8 2164 Adazi Latvia,"Antonella Onesti, Sales DirectorSales Director",+371 27665151
1830,PMSWEET SPRL,www.pmsweet.be,"Rue Cesar de Paepe 43 4683 Vivegnis, Liège Belgium","Michael Labro, Chief Executive OfficerChief Executive OfficerBenjamin Nemayechi, Export ManagerExport Manager",+32 49 7212471
1831,PNZ-PRODUKTE GMBH,www.pnz.de,Eichstatter Str. 2-4A 85110 Kipfenberg Germany,"Andreas Nierobisch, Executive DirectorExecutive DirectorJens Hallmann, Sales ManagerSales Manager",+49 846 517 380
1832,POCO LOCO SNACK FOOD NV,www.pocoloco.be,Rumbeeksegravier 157 8800 Roeselare Belgium,"Thomas Dierynck, Country Manager, GAS and BeneluxCountry Manager, GAS and BeneluxMichel Paternoster, Country Manager, ScandinaviaCountry Manager, Scandinavia",+32 51248022
1833,POGGIO DEL FARRO SRL,www.poggiodelfarro.com,Via Pietramala-Mazzetta 670/A 50033 Firenzuola (FI) Italy,"Silvia Forte, Export ManagerExport Manager",+39 334 6854238
1834,POL-HUN M. BIELSKA SP.J.,www.polhun.pl,11 Listopada 65 95-040 Koluszki Poland,"Tomasz Antosiak, Export SpecialistExport SpecialistIwona Wasiak, Export ManagerExport Manager",+48 44 725 30 00
1835,POLARICA SP. Z O.O.,www.polarica.com,Niemierzyno 3A 78-300 Świdwin Poland,"Anna Krawczyk, Commercial DirectorCommercial DirectorAgnieszka Niechwiadowicz, Senior Sales SpecialistSenior Sales Specialist",+48 601 733 746
1836,POLCA BVBA,www.polca.be,Lodewijk De Raetlaan 40 8870 Izegem Belgium,"Patrick Stove, General ManagerGeneral Manager",+32 472689134
1837,POLENGHI FOOD S.R.L.,www.giancarlopolenghi.it,"Via Giovanni XXIII, 35 26865 San Rocco al Porto (LO) Italy","Jessica Ferrari, Marketing DepartmentMarketing DepartmentRosa Rizzitelli, Export Area ManagerExport Area Manager",+39 0377 569120
1838,POLEXPO EXHIBITIONS PIOTR KARAIM,www.polexpo.pl,Ul. Sloneczna 26 05-816 Michalowice Poland,"Piotr Karaim, PresidentPresidentKinga Karaim, ManagerManager",+48 603 068 798
1839,POLI.COM SRL,www.policomsrl.it,"Via Caduti di Marcinelle, 11 20134 Milano Italy","Francesco Bianchi, Export ManagerExport ManagerTito Polimeni, Sales & Marketing DirectorSales & Marketing Director",+39 3483863625
1840,LABORATOIRE POLIDIS,www.polidis.fr,19 Rue Edmond Blanc 92500 Rueil-Malmaison France,"Bertrand Vignaud, ChairmanChairmanPatrick Pisa, General ManagerGeneral Manager",+33 1 47 51 28 00
1841,POLIPAK SP. Z O.O.,www.polipak.com.pl,Ul. Harcerska 16 63-000 Sroda Wielkopolska Poland,"Magdalena Los-Grzesik, ManagerManagerMaciej Plamieniak, General ManagerGeneral Manager",+48 61 28 532 96
1842,F.LLI POLLI SPA,www.polli.it,Via C. Battisti 1059 51015 Monsummano Terme (PT) Italy,"Manuela Polli, OwnerOwnerVanessa Minicucci, Sales AssistantSales Assistant",+39 0572 95621
1843,POLMLEK SP. Z O.O.,www.polmlek.com,Modlinska 310/312 03-152 Warszawa Poland,"Joanna Kolodynska, Marketing DirectorMarketing Director",+48 605 971 253
1844,"POLYDROS, S.A.",www.cleaningblock.com,"La Granja, 23 Pol. Industrial 28108 Alcobendas, Madrid Spain","Rafael Espinosa, Product ManagerProduct Manager",+34 696932519
1845,POMONA KELLEREI GMBH,www.pomona-kellerei.de,Steinbrinksweg 26 31840 Hessisch Oldendorf Germany,"Marius R. P. Müller, Chief Executive OfficerChief Executive OfficerAnja van der Linden, Business Operations ManagerBusiness Operations Manager",+49 5152 94280
1846,POMUNI FROZEN NV,www.pomuni.com,Vaartstraat 247 2520 Ranst Belgium,"Raf Sels, Commercial ManagerCommercial Manager",
1847,PONNATH (DIE MEISTERMETZGER) GMBH,www.ponnath.de,Bayreuther Straße 40 95478 Kemnath Germany,"Joerg Schilling, Managing DirectorManaging DirectorPeter Schmidt, Managing DirectorManaging Director",+49 9642 30 0
1848,PONZINI SPA,www.ponzini.com,Via V. Veneto 64/68 20824 Lazzate (MB) Italy,"Giulio Ponzini, Chief Executive OfficerChief Executive OfficerPierluigi Prada, Sales DirectorSales Director",+39 02 9630941
1849,POPLAWSKA GROUP,www.poplawskagroup.pl,Clareny 2 Wilczyce 51-361 Wroclaw Poland,"Aleksandra Wysocka, Private Label DirectorPrivate Label DirectorMarta Gasior, Private Label SpecialistPrivate Label Specialist",
1850,POPP FEINKOST GMBH,www.popp-feinkost.de,Carl-Benz-Str. 3 24568 Kaltenkirchen Germany,"Kay Wünsche, GeschäftsführerGeschäftsführerAndreas Lindner, Key AccountKey Account",+49 4191 501 0
1851,POPPIES BAKERIES NV,www.poppies.com,Kasteelstraat 29 8980 Zonnebeke Belgium,"Brecht Castelein, Commercial DirectorCommercial Director",+32 574 60200
1852,POP S.R.L.,www.poptheoriginal.com,Via G. B. Trener 10 38121 Trento Italy,"Lorenzo Puccio, Business Development ManagerBusiness Development Manager",
1853,PORTUGALFOODS,www.portugalfoods.org,Tecmaia - Parque de Ciência e Tecnologia da Maia Rua Eng. Frederico Ulrich nº 2650 4470-605 Moreira da Maia Portugal,"Isabel Araújo de Oliveira, Coordinator Market DivisionCoordinator Market DivisionAna Alves, Market ManagerMarket Manager",+351 220 966 021
1854,THE POWDER COMPANY AG,www.thepowdercompany.com,Mythenstrasse 37 8840 Einsiedeln Switzerland,"Alexander Zurkinden, Chief Executive OfficerChief Executive Officer",+41 55 418 07 77
1855,PPC PAPER PRINT CONVERTING GMBH,www.ppc.co.at,Ponauer Strasse 9a 9800 Spittal-Drau Austria,"Harald Hauke, General ManagerGeneral ManagerIrene Fischer, Sales and Project ManagementSales and Project Management",+43 4762 4191 0
1856,PRALVER S.R.L.,www.pralver.com,Via Tomas Alva Edison 13 37135 Verona Italy,"Ambra Giannini, Quality Control ManagerQuality Control ManagerGiorgio Castellani, PartnerPartner",+39 045506010
1857,PREALPI S.P.A.,www.burroprealpi.it,Viale Borri 80 21100 Varese Italy,"Giovanni Prevosti, Export ManagerExport Manager",
1858,PREMIUM FOODS SOLUTIONS,www.premiumfoods.fr,Z.A. de Bel Air 56130 Marzan France,"Frédéric Garnier, General ManagerGeneral ManagerCharles Guilhon, Key Account Manager ExportKey Account Manager Export",+33 9 71 04 78 44
1859,PRIMA MENÜ GMBH,www.primamenue.de,Westring 22-24 33818 Leopoldshöhe Germany,"Bastian Pauls, GeschäftsführerGeschäftsführer",+49 5202 99 40 0
1860,PRIMAX D.O.O.,www.primax.hr,"Mirogojska 29, Zadubravlje 35211 Trnjani Croatia","Robert Pandža, Chief Executive OfficerChief Executive OfficerVedran Dankić, Commercial ManagerCommercial Manager",+385 354 10222
1861,"PRIME PRODUCTS INDUSTRY CO., LTD.",www.primeproducts.co.th,"589/163 Central City Tower, Flr 32, Debaratna Road, Bangna Nuea, Bangna 10260 ฺBangkok Thailand","Kolatas Manaspiti, Sales DirectorSales DirectorChuanchom Ketkaew, Sales ManagerSales Manager",+66 9655 6969 9
1862,PRIMMED BV,www.travelhealthgroup.com,De Huchtstraat 14 1327 EE Almere The Netherlands,"Tanacha Pijloo, Account ManagerAccount ManagerCorine Schmal, Chief Executive OfficerChief Executive Officer",+31 613384178
1863,PRINIV LTD.,www.priniv.com,Mevuot Gilboa Industrial Zone 1920600 Afula Israel,"Dan Hecht, Export ManagerExport ManagerEfi Dayan, Sales ManagerSales Manager",+972 547700111
1864,PRINO-PLAST SP. Z O.O. JV,www.prino-plast.pl,Wojska Polskiego 48 82-200 Malbork Poland,"Agnieszka Dembczynska, Export SpecialistExport SpecialistMaria Prior-Nowak, Managing DirectorManaging Director",+48 552 702 400
1865,PRINTELA LTD.,www.printela.lt,Technikos 7 51209 Kaunas Lithuania,"Ligita Jankauskiene, Head of SalesHead of Sales",+370 37 310 171
1866,PRIVATE LABELLING EUROPE B.V.,www.p-l-e.nl,Lübeckstraat 9 7575 EE Oldenzaal The Netherlands,"Jan Harberink, Sales ManagerSales Manager",+31 88 260 1080
1867,PRIVATE LABEL PROFESSIONALS,www.plprofessionals.com,Keizersveld 50 Z 5803 AN Venray The Netherlands,"Harry Kellenaers, DirectorDirector",+31 642297779
1868,PRO-PACK PLASTIK AMBALAJ VE MAKINA SAN.TIC.A.S.,www.pro-pack.com.tr,"Turkgucu Osb. Bulent Ecevit Bulvari. No:17 59850 Corlu, Tekirdag Turkey","Kerem Guneri, Export ManagerExport ManagerYakup Palomba, ExportsExports",+90 282 685 4041
1869,PROBAIXA SA,www.armandogoncalves.pt,Zona Industrial de Lamas 29/30 6120-786 Santarém Portugal,"Rui Gonçalves, Coordinator for International RelationsCoordinator for International Relations",+351 214 942 220
1870,PROCHAMP B.V.,www.prochamp.nl,Laarstraat 2 5334 NS Velddriel The Netherlands,"Hetty Peffer, Sales DirectorSales DirectorJoost Hilgersom, International Sales ManagerInternational Sales Manager",+31 418 637 777
1871,PRODIS S.A.,www.prodis.gr,"405 Tatoiou Avenue 16377 Acharnes, Attica Greece","Theodoros Boukouvalas, ChairmanChairmanSamuel Molcho, Sales and Business DevelopmentSales and Business Development",+30 2108076413
1872,"PRODUCTOS DE COSMETICA E HIGIENE, S.L.",www.pchindustries.es,"C/ Monturiol 28 08210 Barberà del Vallès, Barcelona Spain","Jose Maria Gui Casanovas, General ManagerGeneral ManagerXenia Gonzalez, Private Label Product ManagerPrivate Label Product Manager",+34 93 729 48 48
1873,PRODUCTOS SELECTOS DE AGAVE,www.theagavesweetenercompany.com,Av Real de Acueducto 335 Piso 21 45116 Zapopan Mexico,"Gloria Sahagun Tirado, Key Account ExecutiveKey Account Executive",+52 133 333 01100
1874,PROFF PLASTIK SAN VE TIC LTD STI,www.proffplastik.com.tr,Osmangazi Mah. 2653 sok. No 5/A Esenyurt 34522 Istanbul Turkey,"Cem Sultan Dilaver, OwnerOwnerUmut Deniz Mutlu, Export ManagerExport Manager",+90 212 485 6121
1875,PROFIMED SRL,www.profimed.it,"Via Moia, 90 20861 Brugherio (Monza e Brianza) Italy","Ciro Lai, Managing DirectorManaging DirectorElena Longoni, PresidentPresident",+39 02 95343578
1876,PROFUMA SPRL,www.profuma.com,Rue De Lusambo 65 1190 Brussels Belgium,"Moris Shwartsberg, DirectorDirector",+32 486549510
1877,PROLAINAT,www.prolainat.com,Route de Mauvezin 32270 Aubiet France,"Sandrine Ricaud, Marketing ManagerMarketing ManagerChrystelle Pradeilles, Export AssistantExport Assistant",+33 5 62 65 95 11
1878,PROMO SOLUTION LTD.,www.promosolution.net,"8 latrou Liouga Str. 16675 Glyfada, Athens Greece","Vassilis Pingos, Marketing DirectorMarketing DirectorNassos Pingos, General ManagerGeneral Manager",+30 210 9630630
1879,"PROSOL - PRODUCTOS SOLUBLES, S.A.",www.prosol.coffee,"Avda. Tren Expreso s/n 34200 Pol. Ind. Venta de Baños, Palencia Spain","Iván Moré, Key Account ManagerKey Account ManagerMariano Barreda, Key Account ManagerKey Account Manager",+34 979 771 225
1880,RAFTELIS PROTOULIS MARIA AND CO.,www.protoulis.gr,Megalochori 81200 Plomari Lesvos Greece,"Konstantinos Protoulis, OwnerOwnerVlasios Nisiotis, Sales ManagerSales Manager",+30 6988 220 814
1881,PROVEL SANAYI VE TICARET A.S.,www.parex.com.tr,Halkali Merkez Mah. Atlas Sok. Digicom Plaza No:12 Kucukcekm 34303 Istanbul Turkey,"Cahit Filik, Export DirectorExport DirectorKubra Kapcak, Export Area ManagerExport Area Manager",+90 5336043684
1882,PROVINCIE NOORD-BRABANT,www.brabant.nl,Brabantlaan 1 5216 TV Den Bosch The Netherlands,"Jacqueline Lanting, Pavilion OrganizerPavilion Organizer",+31 638062395
1883,PRUNESCO S.P.A.,www.prunesco.com,"Avenida Ramón Subercaseaux 1712 9480018 Pirque, Santiago Chile","Marcelo Lacunza, Commercial ManagerCommercial ManagerJean Escobar Montero, Regional ManagerRegional Manager",+56 224 890000
1884,PRUTUL S.A.,www.prutul.ro,"2 Teheran St., 6th Floor District 1 Bucharest Romania","Bogdan Dascalu, Export ManagerExport ManagerMihaela Merla, Public Relations ManagerPublic Relations Manager",+40 740041372
1885,UK – PS8/FDEA,www.ps-8.com,PO Box 424 KT22 2HL Leatherhead United Kingdom,"Sandra Sullivan, DirectorDirectorKaren Beston, Head of Exhibitions and EventsHead of Exhibitions and Events",+44 20 3318 2967
1886,PT. LAUTAN NATURAL KRIMERINDO,www.lautan-natural-krimerindo.com,"Jl. Raya Mojosari – Pacet Km 4, Ds. Pesanggrahan Kec. Kutorejo, Kab. Mojokerto 61383 Mojosari, East Java Indonesia","Roy Febieanto, Export ManagerExport Manager",+62 321599778
1887,PT MUNDIAL RASA INDONESIA,-,12a Kel. Timbang Deli Kec. Medan Amplas 20148 Medan Indonesia,"Sumit Guha, Director Edible Solutions (Agent)Director Edible Solutions (Agent)Akvile Stankevice, Marketing Edible Solutions (Agent )Marketing Edible Solutions (Agent )",+62 61 42780269
1888,PTPD CMANA DOO KRNJEVO,www.cmana.rs,Bulevar Oslobodjenja 16 11319 Krnjevo Serbia,"Ivan Grujic, Chief Executive OfficerChief Executive OfficerMiroslav Stanojevic, Sales ManagerSales Manager",+381 264150444
1889,PULJONG OÜ,www.foodstudio.eu,Pilvetee 6 12618 Tallinn Estonia,"Helgor Markov, FounderFounderAnni Ojokas, Export ManagerExport Manager",+372 5236166
1890,PURE CHOCOLATE SIA,www.purechocolate.lv,"""Abelziedi"" LV-3124 Pure Latvia","Rihards Zvers, Export Sales DirectorExport Sales Director",+371 29234508
1891,PURE FLAVOUR GMBH,www.pure-flavours.com,Landsberger Straße 318d 80687 Munich Germany,"Dominik Guber, Co-Founder and Chief Executive OfficerCo-Founder and Chief Executive Officer",+49 89 904 206 0
1892,PURELLA SP. Z O.O.,www.purella.pl,Wiernicza 32 02-952 Warsaw Poland,"Anna Slazynska, Export and Private Label ManagerExport and Private Label ManagerArtur Gajewski, Marketing DirectorMarketing Director",
1893,"PUREPLUS CO., LTD.",www.pureplus.co.kr,"11, Sudongnonggong-gil, Sudong-myeon, Hamyang-gun 50022 Gyeongsangnam-do South Korea","Peter Cho, DirectorDirectorRicky Kim, Sales ManagerSales Manager",+82 32 523 1800
